file,title
bd86c43263cb9345ccf6a418f433181a26f66e19.json,Early observational research and registries during the 2009- 2010 influenza A pandemic
6e5335a23578850b79d683e1a9d89546583dd94a.json,Limiting the spread of highly resistant hospital-acquired microorganisms via critical care transfers: a simulation study
2f8c3378797159662e0d94b5dfb07c1b5bb88579.json,Effects of ambient temperature on volume
3d435bcdab8b1d94057f836ce8e4f2f7341e57bc.json,Syndromic Surveillance Using Regional Emergency Medicine Internet
766e0afdd0d3c2a1f8d9a6c8b318ca401db0a8bd.json,c Ann Arbor Veterans Affairs Hospital
d9c950cf19a2048596a6e143471fb2d0c009d8f0.json,CASE STUDY System effectiveness of detection
b4d499844440e3aacd1644715092e8d170e39517.json,Current topic
df6046348bb422f277c38c41f86dedff3843bbab.json,Health care workers' views about respirator use and features that should be included in the next generation of respirators
183e393843de9d6c653897f1039ad10af9750347.json,Patterns of seasonal and pandemic influenza-associated health care and mortality in Ontario
eea7ee3da4fcd0dc1f2fb5297f169fc08acd6362.json,Beliefs underlying blood donors' intentions to donate during two phases of an avian influenza outbreak
415ccc587d634fc429ac080cf06694f78621ef73.json,Household transmission of respiratory viruses -assessment of viral
63034361dfaf8aabcc9a5aa6dcc68c1d09235748.json,The Impact of Severe Acute Respiratory Syndrome on Medical House Staff A Qualitative Study
78ab35770cc98632c434523df48c6ba290182d37.json,Excess cases of Influenza like illnesses in France synchronous with COVID19 invasion. Pierre-Yves Boëlle 1 and the Sentinelles syndromic and viral surveillance group
44bdee5bb927cb58ca1791c02466ecb45ebf5ef6.json,A community-based approach to influenza assessment and treatment during a pandemic
d6bbcc059331dda0ac8c4a897f4d7171d0d1cb99.json,Brief Communication Psychological Responses among Humidifier Disinfectant Disaster Victims and Their Families
6cbefcf4c0fbb8466db7d00b8f53e1f37a6bf8b5.json,Title: Integrated Disease Surveillance and Response (IDSR) in Malawi: Implementation Gaps and Challenges for Timely Alert Submit journal: PLoS ONE
a5e0abe0412493312962d8380f2563c124c709c2.json,A core competency model for Chinese baccalaureate nursing graduates: A descriptive correlational study in Beijing
96250a5e9ece21b2415b83d6756a3fcd07123ee7.json,Scientometric Trends for Coronaviruses and Other Emerging Viral Infections
42d591ee60f6c593530251494f9cb93a23221082.json,Lessons learned from the anti-SARS quarantine experience in a hospital- based fever screening station in Taiwan
defd90d30189ee3f111999fba52835d0af6e80b4.json,The Past
b51603b65f40d384c4aa0f11379f0dcc387e46b1.json,Use of Obstetric Practice Web Sites to Distribute Zika Virus Information to Pregnant Women During a Zika Virus Outbreak
7fcf80c8e74a2f858bf9f6c2f43c2b879152f007.json,Current status of personnel and infrastructure resources for infection prevention and control programs in the Republic of Korea: A national survey
7cd8d3fec1f3a8251b75a50aad856e1b5526de83.json,Core components for effective infection prevention and control programmes: new WHO evidence-based recommendations
b2e781c81e340e91a0f27009b29d0c8a3635c5e8.json,Evaluation of the sentinel surveillance system for influenza-like illnesses in the Greater Accra region
9dc34862d293de4b2fc5d07d28362045d71f51a6.json,ARTICLE IN PRESS G Model Enablers of
8a8463146cf8f61c2d62df2adaa251adbe2f9dc1.json,Burden of influenza
797c6ecb7d0eb5d6eb5ea5f081a3c4cc78be5bd2.json,Including the public in pandemic planning: a deliberative approach
39e643e0263bee019519c0c51f4ae17f1fe1a0a5.json,Strategy and technology to prevent hospital-acquired infections: Lessons from SARS
bd614a6233ff72830a79371d92a7680e1b8af33b.json,Nr Year of finishing survey Countries Authors of first publication Year of first publicatio Relevant publications Study settings Study subjects Final Sample size Response rates Sampling scheme Data collection tools Collection modes
1008bb267f9b05fcec7b715eab47f4a5c659c7dd.json,Teacher led school-based surveillance can allow accurate tracking of emerging infectious diseases -evidence from serial cross-sectional surveys of febrile respiratory illness during the H1N1 2009 influenza pandemic in Singapore
943f2beb4d32bce84617c72677a277224b73fd8f.json,Lack of SARS Transmission among Public Hospital Workers
1f7b47ec5e68a274a145bddd152303eba2f9d035.json,Pandemic Influenza A (H1N1) and Its Prevention: A Cross Sectional Study on Patients' Knowledge
ebed3cc5b0f4f9aa5a2dd3fd6f107c7a3a707914.json,Pandemic Infl uenza and Hospital Resources
8c7de742ccdab73cf04032fc703ad83aa65b685e.json,Stockpile of personal protective equipment in hospital settings: Preparedness for influenza pandemics
86f945ac3cc56d2dfba02f4524e37515f038a1c5.json,Contacting Passengers After Exposure to Measles on an International Flight: Implications for Responding to New Disease Threats and Bioterrorism
6bfd7a2e092c039e792bae569c8406f2a47c2759.json,Professional and Home-Made Face Masks Reduce Exposure to Respiratory Infections among the General Population
bceb7b4cbae953e40d6425896499511c15d62420.json,Journal Pre-proof How to link patients with suspicious COVID-19 to health system from the community pharmacies? A route proposal
4b2607f3da8bf06c231145105ffd5ca24a07bbda.json,Adherence to precautions for preventing the transmission of microorganisms in primary health care: a qualitative study
7740cafff20a808697d26091851c30416eadfe53.json,Risk Factors for Primary Middle East Respiratory Syndrome Coronavirus Illness in Humans
f26e6414e5f5d4b4f38874d6670f101ffce31542.json,Internet-based surveillance systems for monitoring emerging infectious diseases
eb4b8f43f68db5e493984b7e4e56d9f804d7e885.json,BMC Public Health Can the concept of Health Promoting Schools help to improve students' health knowledge and practices to combat the challenge of communicable diseases: Case study in Hong Kong?
0435a1cb65b4c757d0a78b0f6d8c4383a5104615.json,The infection control audit: The standardized audit as a tool for change
53a1a83e835369591e1fc7133dbf00350be32d11.json,Twenty-five years of research on the behavioural malaise associated with influenza and the common cold
f2a3bd788194db3626ddc6650be02da7061b84cc.json,Social and political determinants of vaccine hesitancy: Lessons learned from the H1N1 pandemic of 2009-2010
d62785143ed659114805266f7c37f0ca7edebf9e.json,The emerging use of social media for health-related purposes in low and middle-income countries: A scoping review
4465b8957219de75fb5b7f7ed57069405572cf00.json,Visibility and transmission: complexities around promoting hand hygiene in young children -a qualitative study
e5a10a7f2c9bb07f74fcce076a62f63f859cf3a4.json,Resource-Limited Settings
ea7ae35a6203f68c29d8aa305a9d89ba8c76d284.json,Diagnostic issues and capabilities in 48 isolation facilities in 16 European countries: data from EuroNHID surveys
5c497b4f9cd88c74f3eb936c49cdba1703f94493.json,The experience of the 2003 SARS outbreak as a traumatic stress among frontline healthcare workers in Toronto: lessons learned
70495720c6d89fd633436c0f6841ce91dd16cce1.json,Assessment of ambulance dispatch data for surveillance of influenza-like illness in Melbourne
e7c33e28e57b649ac477f8290b35a3b10e2a1353.json,Knowledge
30527cbd6ff75b274b1c11b6b899cad508543bb5.json,PERIOP BRIEFING
98daa537c1c7d0eaa36143d8e646147878799671.json,Public Willingness to Take a Vaccine or Drug Under Emergency Use Authorization during the 2009 H1N1 Pandemic
8ca1a1c3ca665b86971a5d9d9da6fec6f71edaf2.json,Automatically quantifying the scientific quality and sensationalism of news records mentioning pandemics: validating a maximum entropy machine-learning model
ac9e179aeff880553f01d4756e98e7aa95448642.json,Experiencing SARS: Perspectives of the Elderly Residents and Health Care Professionals in a Hong Kong Nursing Home
0fa08a2ee0fadf2bb691ff97f79c4403b3ae0ede.json,Tuberculosis infection via the emergency department among inpatients in South Korea: a propensity score matched analysis of the National Inpatient Sample
192e7d37cf521798de0394c2ad593f2bb77f5a77.json,Obvious and Hidden Anxiety and the Related Factors in Operating Room Nurses Employed in General Hospital
e7c5c521429586c3ce0555bcadd8742901d03cf6.json,C L I N I C A L 218 JOURNAL OF EMERGENCY NURSING
51a2dad6387cc9aa3f9d5d73c83f1df8b4ba021d.json,OJPHI Early-warning health and process indicators for sentinel surveillance in Early-warning health and process indicators for sentinel surveillance in Madagascar 2007-2011
21da794e98e8be994e33769716ad60f58cad389e.json,Morbidity and mortality amongst Indian Hajj pilgrims: A 3-year experience of Indian Hajj medical mission in mass-gathering medicine
c23885ee86a26256aff2a6f527e05d3f285bee2f.json,The Joint Commission Journal on Quality and Patient Safety
9055c2a1c584b084a9339c4919b59c7a26245182.json,epic3: National Evidence-Based Guidelines for Preventing Healthcare-Associated Infections in NHS Hospitals in England
34e9fce03b5a874c55b510415614d40493cdb536.json,American Journal of Infection Control
871ef8cb355670f332575e941ebf1aa0667afb5d.json,Assistant Professor of Internal Medicine
c58195e4e9894fdbf2e89872912cd0fb46c9f947.json,796 www.eymj.org
4bde0e7dd1c91ec8d150addef2288cb9ec7d51ad.json,User acceptance of reusable respirators in health care
ed9bd29d43d2781618f8c3133dd85492af8960ce.json,UK newspapers' representations of the 2009e10 outbreak of swine flu: one health scare not over-hyped by the media?
e6d560c0ed2c420b3ca34de569c8a46d3722e2da.json,Validation of the Arabic Version of the Early Childhood Oral Health Impact Scale (ECOHIS)
cc99fbad2dc02c8b3848fcd294a00c91fc7b4fde.json,An assessment of the emergency response among health workers involved in the 2010 cholera outbreak in northern Nigeria Cholera outbreak emergency response in Nigeria
01cadfe2bb23b6989e57fce2ba744691557faa93.json,Positive experiences of volunteers working in deployable laboratories in West Africa during the Ebola outbreak
e6b8ff26b423ef6507f006d69f9a183fb1147988.json,The More the Better? A Comparison of the Information Sources Used by the Public during Two Infectious Disease Outbreaks
cad994637f061356cd5ea11a7570b2f5ad38ed47.json,Estimating Potential Infection Transmission Routes in Hospital Wards Using Wearable Proximity Sensors
84737ac767f2be6c8623fb433c75e0fa5faf95b0.json,Serial Multiple Mediation Analyses: How to Enhance Individual Public Health Emergency Preparedness and Response to Environmental Disasters
3e276874c125f0c8c8490eb41e9ae26cf767447c.json,Appendix A: Study Interventions Mindfulness Meditation
15725f58fc5a9f23c2d12dd7695557771f2dd857.json,Leveraging social networking sites for disease surveillance and public sensing: the case of the 2013 avian influenza A(H7N9) outbreak in China
99f70ba1e268514c14cbbebc998becbc92e2c386.json,Development of a short course on management of critically ill patients with acute respiratory infection and impact on clinician knowledge in resource-limited intensive care units
2d7dbafa3bd0f27b119ac0d00e8a785122adcaf9.json,Technical Description of RODS: A Real-time Public Health Surveillance System
06e9041ff3cb1db28a5df4c73ae0942e1ee42b1f.json,Selected Nonvaccine Interventions to Prevent Infectious Acute Respiratory Disease
68b8a4f644c4195bd6a89ea7e70cd45072ea979e.json,Impact of Comorbidity on Fatality Rate of Patients with Middle East Respiratory Syndrome
d0e4a23b392c97a4cce74b1da7bffffa6eee36ed.json,TITLE (PROVISIONAL) Household Preparedness for Emergency Events: a cross-sectional survey on residents in four regions of China AUTHORS VERSION 1 -REVIEW REVIEWER
7df37eb3cc184f38b1d97fe12f7176b5da78f77f.json,Effect of Information Disclosure Policy on Control of Infectious Disease: MERS-CoV Outbreak in South Korea
165cfcb6f439f6d779d1e94b0b8a3db96c79b22e.json,EPIDEMIOLOGIC INVESTIGATION Healthcare worker infected with Middle East Respiratory Syndrome during cardiopulmonary resuscitation in Korea
9633dd466a1f1c402c18d7db00bae7bf1eea5250.json,Clinical and epidemiological characteristics of imported dengue fever among inbound passengers: Infrared thermometer-based active surveillance at an international airport
2aac4f808ecf429a389fb473ebd06e44b152db6d.json,Epidemiology and predictors of survival of MERS-CoV infections in Riyadh region
1185a17f1cb650e0433ab8c84202cc242c54f6cc.json,Cost-effectiveness analysis of N95 respirators and medical masks to protect healthcare workers in China from respiratory infections
fca0580d965f2ac6c66e345eab40c436d6468c66.json,Assessment of correlates of hand hygiene compliance among final year medical students: a cross-sectional study Assessment of correlates of hand hygiene compliance among final year medical students: a cross-sectional study Article Summary
fc6ab4b693bda93d6d96fed4c7ffba6510d04e0e.json,Lack of Transmission among Close Contacts of Patient with Case of Middle East Respiratory Syndrome Imported into the United States
478ccb65a95307d000fa985086b6a71984d1017a.json,Infectious Disease Surveillance and Early Warning System During Beijing Olympic Games
15be13113a5e44ed6b5df14bf3eb31d7c0ca37a3.json,Remote sensing of multiple vital signs using a CMOS camera-equipped infrared thermography system and its clinical application in rapidly screening patients with suspected infectious diseases
4b0e55086b61f6d48b3dddc126d77426f7bc3569.json,Toward sustainable and effective control: Experience of China Ebola Treatment Center in Liberia China ETC help curb the Ebola epidemic
d4718ccc1c08a82371c1d7525aae8cc567ff2424.json,Chinese Social Media Reaction to Information about 42 Notifiable Infectious Diseases
59c84e06ac8246b44efc595cafef84b946f24219.json,Perceptions of postoutbreak management by management and healthcare workers of a Middle East respiratory syndrome outbreak in a tertiary care hospital: a qualitative study
f1601a671f236a958f936c3019ef3459f27041a5.json,NEW PARADIGM FOR PROTECTION: THE EMERGENCY AMBULANCE SERVICES IN THE TIME OF SEVERE ACUTE RESPIRATORY SYNDROME INTERNATIONAL EMS
778a0fd080fb4b2e27dfc13099c7eeabbb565f40.json,Perceptions of hand hygiene practices in China
ceeb2a3a137a1a1a4a86614ce734f07afea72d4c.json,The Sustained Value of an Early Pregnancy Assessment Clinic in the Management of Early Pregnancy Complications: A 10-Year Retrospective Study
38cd6b46c7c1a506a670a194b250029ab019d371.json,Registered nurses are at increased risk of hospitalization for infectious diseases and perinatal complications: A population-based observational study
60d68e4052a397966e72c6eda0895ca7d27afb68.json,Improving rheumatic fever surveillance in New Zealand: results of a surveillance sector review
ea3edffefb5fa20412b31e223330af336503afaf.json,Accuracy of epidemiological inferences based on publicly available information: retrospective comparative analysis of line lists of human cases infected with influenza A(H7N9) in China
01e3d931c0bc070ec620b87029b32e18be9e405e.json,Public Understanding of Medical Countermeasures
e9d32ac6db6f898b035aab6d4357342c3ae2442b.json,A Surveillance System to Reduce Transmission of Pandemic H1N1 (2009) Influenza in a 2600-Bed Medical Center
a4e2f812c3232e60ac1af78fed10d292e28906d1.json,Using the Electronic Medical Record to Identify Community-Acquired Pneumonia: Toward a Replicable Automated Strategy
b35c5f90e09d90f6fd6cff9dab355755e4c33fe4.json,Situational Awareness and Health Protective Responses to Pandemic Influenza A (H1N1) in Hong Kong: A Cross- Sectional Study
709fea3df3da75c040b2fa2b8d16074851737d6e.json,Suicide news reporting accuracy and stereotyping in Hong Kong
624d182cc7495a9fd996eb51663e8774a42d2cca.json,Evidence-based support for the all-hazards approach to emergency preparedness
517ede99b17b09eda6a84893b3c7105eb5f0b89f.json,B95: A new respirator for health care personnel
4b6924e8a47cd58844905f4ce2a134e44783d68b.json,Adoption of preventive measures during and after the 2009 influenza A (H1N1) virus pandemic peak in Spain ☆
4ed2b0198011b3339c4330a0c72168932bbfc863.json,| Division of Health Security and Emergencies
ad64637f84246d552d9d2cc5b13d66a51f8cc7bf.json,The 2003 SARS outbreak and its impact on infection control practices
306d48f87402c3759c22d1c5fbfe4ddce3fd5967.json,antibiotics Antimicrobial Stewardship Programs in Community Health Systems Perceived by Physicians and Pharmacists: A Qualitative Study with Gap Analysis
c14ce2c27ca770924c1ca4a4fef0fa5b532f73c1.json,Cluster randomised controlled trial to examine medical mask use as source control for people with respiratory illness
5aea42c8922c84b19c8ae83793d535d53667a772.json,Posttraumatic Stress after SARS
3f659542438aaa6eec647cd31b6123c31e8f1c0e.json,A framework for identifying regional outbreak and spread of COVID-19 from one-minute population-wide surveys
879df084e06fcce1980e3f73c36748068b39f049.json,Ebola or Not? Evaluating the Ill Traveler From Ebola-Affected Countries in West Africa
0c0e91904a6c84a7ee80cc69fe83370aaa3ca708.json,Travel-related MERS-CoV cases: an assessment of exposures and risk factors in a group of Dutch travellers returning from the Kingdom of Saudi Arabia
6a68e3a345d7da33f2fcb9456aca1998647cb69e.json,Therapeutics and Clinical Risk Management Dovepress seventy-two-hour emergency department revisits among adults with chronic diseases: a saudi arabian study
f94f3f9c995ef8de18758ca0eea7075f83454065.json,Pandemic planning in pediatric care: A website policy review and national survey data
7f9fa006a1bca13cf8c83d29118ff4f067fd5e19.json,Design and validation of a questionnaire to measure the attitudes of hospital staff concerning pandemic influenza
3208852c9234f3d7d415af376bdb22cdb95f5bba.json,Emergency Department Response to SARS
3148f3c48df3ecc495ce6ec7caaebcaddd1340fc.json,Airport Exit and Entry Screening for Ebola -August-November 10
25affabb80bcf3e1a60c00fc09fd5d2e8f89ec48.json,Do Intensive Care Data on Respiratory Infections Reflect Influenza Epidemics?
1f26a27ef199662ad4b8648b40442f0d951b81ec.json,A framework for capturing the interactions between laypersonsÕ understanding of disease
f734d47a423cbe54ec0cc9b2dee39470cf74fd9b.json,Novel Coronavirus (COVID-19) Knowledge and Perceptions: A Survey of Healthcare Workers
a336fd69f73d0debd55b454b97ff45cf9f39d82a.json,Containment measures for emerging and re-emerging vector-borne and other infectious diseases of poverty in urban settings: a scoping review
81d081e98b0ce8f89cb385a162ae749c2400564f.json,Nurses' willingness to take care of people living with human immunodeficiency virus/acquired immunodeficiency syndrome (HIV/AIDS) -does a teaching intervention make a difference?
9b1db58b45ac9db3de3c103db7e9de544c6c3eea.json,Provider Perspectives on General Practice in Henan
5eec2a24d87a846e43dacb1f973271ff481eabc4.json,EMERGENCE OF SARS
e008bb9bd16411df2029bfbfd2df3fef72a7e575.json,SYSTEMATIC REVIEW Extreme water-related weather events and waterborne disease
918502b9ff6b04705babfc9e08f9b0f7c7ece9cc.json,Retention strategies in longitudinal cohort studies: a systematic review and meta- analysis
8ef99170acaf22a944558d25568e2f3339e09cd3.json,Delayed Suspicion
e1b312167d5ea6a1ed3c071b05b7bd0a48a975df.json,Structural Factors of the Middle East Respiratory Syndrome Coronavirus Outbreak as a Public Health Crisis in Korea and Future Response Strategies
cbbf2c867d16605a4802dfeea0b9a2b21d8ccb47.json,Screening for Infl uenza A(H1N1)pdm09
2afa3da371e5495dd55f0b4dde4ae7700eaf99d6.json,Rhinitis
6008f2262f07f43ae8391384e5fa2d99bd1fae8c.json,Evaluation of respiratory protection programs and practices in California hospitals H1N1 influenza pandemic
23696844593c72dd8c4d74607ff26049336fe9b0.json,Geographic Access to High Capability Severe Acute Respiratory Failure Centers in the United States
3788141dfb6c7e8b0904e40e81b0c508cb25358f.json,Investigating an outbreak of acute fever in Chuuk
183dc10a5eac02c39b5c2b6151c6eb6fc6cf88a3.json,Daejeon Provincial Government
f1143e754cc1c67b9e8322fe210c9c5b03096f24.json,Articles Travel-related infections in mainland China
ba8b84d098601b0458f748ff845d8eb1b69f105f.json,Emergency Department Design
e67ef0b92b9b359d8ff4f64dc0ca63fc09b63c55.json,Validation of the Impact of Event Scale-Revised for adolescents experiencing the floods and mudslides
7b7cf3bd29c1cfbac643c487c643b07a827e3aa2.json,Depression after exposure to stressful events: lessons learned from the severe acute respiratory syndrome epidemic
76f6ff5bb2329dfd14355265b01d3615d225fb9f.json,A6eA8 A7 Editorial
65f65eebae12ff976b0373b64a6b5e78be3f0878.json,Protecting health care workers from SARS and other respiratory pathogens: Organizational and individual factors that affect adherence to infection control guidelines
360991ff283a6ec08b264813dba65427cecfa615.json,Reported Direct and Indirect Contact with Dromedary Camels among Laboratory-Confirmed MERS-CoV Cases
494fae7487de60e531d249e42bdb27a4153cd432.json,China Infectious Diseases Automated-Alert and Response System (CIDARS)
b45169a9f726617e4906ab621fb6340281a79272.json,Infection control influence of Middle East respiratory syndrome coronavirus: A hospital-based analysis
2a5d09bdb532096261be55490d99eb996e05ea18.json,Senegal
6739c28085b8fbb42bd1ad24108df30c37328357.json,Factors influencing seasonal influenza vaccination behaviour among elderly people: a systematic review
1e4a05b0bb552c2008870b965dad8605710fce2b.json,High-temperature indices associated with mortality and outpatient visits: Characterizing the association with elevated temperature ☆ 
59e6dfead3d50788eb626a32f19305afce88bc63.json,Comparison between dairy cow disease incidence in data registered by farmers and in data from a disease-recording system based on veterinary reporting
310f2c636d121f3a0e48ccaf6b97e4c3c8ce5abe.json,Protection afforded by respirators when performing endotracheal intubation using a direct laryngoscope
51f8792fd26cd2c094c1b2d0e5539902fb6221da.json,People at Risk of Influenza Pandemics: The Evolution of Perception and Behavior
dd916c3ebb297ef2b6a36f7d6f33bac8ed1198b8.json,Development of rapid guidelines: 1. Systematic survey of current practices and methods
49d290076b8c6c52dc7780d2902c4de9fbe02ad6.json,Family caregivers in public tertiary care hospitals in Bangladesh: Risks and opportunities for infection control
e4b977e389f9ceedc3a0cbae5b7b0df458cef0f7.json,Characteristics of flu response centre staff in the West Midlands
ee1b5a9618dcc4080ed100486cedd0969e80fa4d.json,BMC Infectious Diseases A super-spreading ewe infects hundreds with Q fever at a farmers' market in Germany
19cc8623f4bbacbd1747b395b755c7491a3f82c8.json,Barriers to implementing antimicrobial stewardship programmes in three Saudi hospitals: Evidence from a qualitative study
248470bd32929e3290b0a5742bffc266cdc5622b.json,The experience of SARS-related stigma at Amoy Gardens
360d7a85fefdad638d52a705f668d2047fc63ce7.json,Characterization of patients transported with extracorporeal respiratory and/or cardiovascular support in the State of São Paulo
cbb02b21e4165b060929344f2f02ab6859016be3.json,Causes of variability in prevalence rates of communicable diseases among secondary school Students in Kisumu County
00951716e01c8e0cc341770389fc38d1b5455210.json,Knowledge of
ede826958e62657b37c75bcbf5570b26a88db97b.json,Impact of infectious disease epidemics on tuberculosis diagnostic
181e7e77b6c9cbcfbe32a166aa74768f0dfd29ed.json,Disaster Nursing: A Retrospective Review
5f28070e492b933fa2cfd460fd67b9f6731c4345.json,| WHO Health Emergencies Programme
2d102f7db396b4358f23cab728f3af3d8871c39c.json,Protective Behavior and West Nile Virus Risk
c2e668e734c12f90baca2111bd639dcd86affca2.json,Estimation of the impact of providing outpatients with information about SARS infection control on their intention of outpatient visit
19d93173c328e9ca42bd4238ccb39aa8da818422.json,An exploration of social and economic outcome and associated health-related quality of life after critical illness in general intensive care unit survivors: a 12-month follow-up study
858eca14268b1cc8c98114b21c934bc09c8c8aee.json,The rationale of fever surveillance to identify patients with severe acute respiratory syndrome in Taiwan
4696f5b67a3c721e099958094a85220c09095b69.json,Impact on health care workers employed in high-risk areas during the Toronto SARS outbreak
37142e322bc30493a97e2aff05533919897e39ef.json,Using exercises to improve public health preparedness in Asia
743c5db7611d4af74204901e0ed3b6317a0bb3c4.json,Knowledge
a829488e75a4af749d8fc997fcf24ebeb907228b.json,Risk Factors for Middle East Respiratory Syndrome Coronavirus Infection among Healthcare Personnel
dee0aa9ba97f07a5635f79ce50cf17abaa2b699a.json,Epidemiological characteristics of pulmonary tuberculosis in Shandong
6f95128d6a8899b5c90dc234a613d4b08415a9e2.json,The process by which perceived autonomy support predicts motivation
da52bc30f65ff8b0a179d27368458780d671090c.json,Health behavior education
faada181a26e163dce05aa155b1516a66bb6154b.json,Airport sentinel surveillance and entry quarantine for dengue infections following a fever screening program in Taiwan
f24931f2cc96a33d37fdd1ad97b3b694724b856a.json,Airborne transmission and precautions: facts and myths
b39d735fc952ab8598b57fe05c2bf26bdd3d5fd0.json,King Saud bin Abdulaziz University for Health Sciences
69422fc5757c3c88a574d830594a4dc1a06337b9.json,BMC Infectious Diseases Small islands and pandemic influenza: Potential benefits and limitations of travel volume reduction as a border control measure
3b6d953fa2770589cb1f699047f2d94990cfa4ad.json,Psychological Flexibility of Nurses in a Cancer Hospital: Preliminary Validation of a Chinese Version of the Work-related Acceptance and Action Questionnaire Original Article
dbf3bd1618e6cd7782e790c443d9eccbbe5eb0f2.json,Evaluation of a national pharmacy-based syndromic surveillance system
3024739cfc1f411186c0844a254501c14301c935.json,Exposure Patterns Driving Ebola Transmission in West Africa: A Retrospective Observational Study International Ebola Response Team
357a008270023e621d758ada372b14e676edb782.json,Facing the threat of influenza pandemic -roles of and implications to general practitioners
