file,title
91f85fd66b90fad1835d46d97ce61ff23e4d7072.json,Post-pandemic assessment of public knowledge
2468815380ef0da6656eafec81936b459b5b210e.json,No-Notice Mystery Patient Drills to Assess Emergency Preparedness for Infectious Diseases at Community Health Centers in New York City
3c3068bf6e652c02d85923d2438ad4c84d53071a.json,Social Consequences of Ebola Containment Measures in Liberia
92219161c16ed7c1719549677c40a821fbb54853.json,The predictors of 3-and 30-day mortality in 660 MERS-CoV patients
18d974723052f0e2a2252691db19ae332463fe7c.json,Examining the inclusion of patients and their family members in infection prevention and control policies and guidelines across Bangladesh
107c18d15d6d233fafa94e71a6de61ce53f0a595.json,Insight into capacity planning for cardiac catheterization services: Policy lessons learned from Looking in the Mirror over a decade
888f3a42d4361d36b3ffbe619427ace11fae0e1b.json,Knowledge and attitude of healthcare workers about middle east respiratory syndrome in multispecialty hospitals of Qassim
06b07a6407734edcb3af57da5fe2898ba61d1df8.json,Evaluation of a Redesigned Personal Protective Equipment Gown
298e8511b1cdc6b1118cb94dd06ae0b69d916f17.json,Preparing for an influenza pandemic: healthcare workers' opinions on working during a pandemic
2f3f3fc88a1b21cfb6c1e38e5cd61b856e6caab8.json,SARS Risk Perceptions in Healthcare Workers
647652b31779d67fcdecf1848f7492b2ab10a4ee.json,High correlation of Middle East respiratory syndrome spread with Google search and Twitter trends in Korea
57df78198df2774be87635b81f850b6eeb2dd6f8.json,Measuring multimorbidity beyond counting diseases: systematic review of community and population studies and guide to index choice
1c2ce6b7b41ede38c22116565b1d4530606729d0.json,Psychological impact of the 2015 MERS outbreak on hospital workers and quarantined hemodialysis patients
db3e9d24065c726bb6613045dddac9031b05e73b.json,Barriers to the use of face protection for standard precautions by health care providers HHS Public Access
58fb8d93d12fa05910ca0a18c3c6af7d65e27cf6.json,Emergency department registered nurses' disaster medicine competencies. An exploratory study utilizing a modified Delphi technique
64ee665b9ca47283ff31e1789655e70838efc849.json,Cohort Profile: The Flu Watch Study
fe2c4dd2b0a96acbdcd6566d94bf227c497995ef.json,Open Access Fever Screening and Detection of Febrile Arrivals at an International Airport in Korea: Association among Self-reported Fever
abf711d63c1164c213353af773e916b2c061004f.json,Relationships between cold-temperature indices and all causes and cardiopulmonary morbidity and mortality in a subtropical island ☆ 
9ffa106061fd815e4bb93389274819e640dfb840.json,BMC Infectious Diseases Initial psychological responses to Influenza A
e6a192287ab14152f32dfa5c2a25537bcc71fe1c.json,The impact of ambient fine particles on influenza transmission and the modification effects of temperature in China: A multi-city study
11ae714b01d105e39919f2a6d9b2471153963d25.json,Overcrowding in a neonatal intermediate care unit: impact on the incidence of multidrug-resistant gram-negative organisms
497065a88412aca3ce4d3de9ebad13ce175e5f18.json,Neuropsychiatric Disease and Treatment Neuropsychiatric Disease and Treatment Dovepress Parental bonding and attitudes toward suicide among medical college students in Japan
3bb350b565dbdabcca5d2fea3068a797658f0477.json,Evaluation of respiratory protection programs and practices in California hospitals during the 2009-2010 H1N1 influenza pandemic
c0f7f46699d0ecf0c7ead699d564d952508e6f81.json,Behavioural intentions in response to an influenza pandemic
0d3660f6d2f449dd0b5c17517db82cc88a9da01b.json,A survey of optometry leadership: Participation in disaster response
a0e248d677e3cafcdcec752caa6930d32c214b9b.json,Impacts of SARS on health-seeking behaviors in general population in Hong Kong
dcb33ca2b0b8e86f785e7e1df0f23d5648e34bc5.json,Environment and Health in Children Day Care Centres (ENVIRH) ---Study rationale and protocol ଝ PALAVRAS-CHAVE Introduction and study rationale
c607f62f8c853f6178cf2e605f468982e60bf5dd.json,epic2: National Evidence-Based Guidelines for Preventing Healthcare-Associated Infections in NHS Hospitals in England 1 Introductory section 1.1 Guideline Development Team
3a76cfcb2772d209f1eb0ab9f48d3edda2c4fdd7.json,JIPH-1244; No. of Pages 5
2f29a1ce62d3b3acc350c357e50cbdb67ea92eb5.json,Ann Arbor Veterans Affairs Healthcare System
aecd12a815bf5fd6486b92bc8fb631d00fef541f.json,Open Access Using simulation for training and to change protocol during the outbreak of severe acute respiratory syndrome
f3016563bf2b8e925c63a3c6a9e11e287907863c.json,Patient factors that affect trust in physicians: a cross-sectional study
f2b1074882bd3bdb8794c79fb4ab6fb72fbbf2ee.json,Calculating the burden of disease of avian-origin H7N9 infections in China
eac85c85c3a2ac1d3fe53e1e3b3fee98f52527ad.json,Evaluation of preparedness of healthcare student volunteers against Middle East respiratory syndrome coronavirus (MERS-CoV) in Makkah
3ed4b5616c342d7185015a8553a8f8350511ca21.json,Infection control management of patients with suspected highly infectious diseases in emergency departments: data from a survey in 41 facilities in 14 European countries
1ee191cacc6d1a57595b53dca3f178fe34050079.json,Non-pharmaceutical interventions for the prevention of respiratory tract infections during Hajj pilgrimage
eae82da25e8df59f046a3c31405984543b53dc2e.json,Public Response to Community Mitigation Measures for Pandemic Infl uenza
04f9e08f4eb5091105c2cca3133719d1bd10b1dc.json,Attempted early detection of influenza A (H1N1) pandemic with surveillance data of influenza-like illness and unexplained pneumonia
b83b223d7e9170483710f5275f46cd578730990f.json,Dying and caring on the edge: Taiwan's surviving nurses' reflections on taking care of patients with severe acute respiratory syndrome
47f65bff75b7752a38ccbb540fbd74955b3addea.json,Demonstration of four entities of appendicitis in China through studying cluster/outbreak
4e30ead25a8574d9013af8ea6f6d5a1be19e41b1.json,Low to medium-low risk perception for dengue
9184bdfa1e2e688ba4e93f80218c7d3872961521.json,Evaluation of the rationale for concurrent use of N95 filtering facepiece respirators with loose-fitting powered air-purifying respirators during aerosol-generating medical procedures
333cbdcd64f39287a3e3d98cd9497c05f559c4f1.json,Fight or Flight: The Ethics of Emergency Physician Disaster Response
b1b2eb98641f5fbf2b51cb26566196ae59a7ad96.json,Monitoring of risk perceptions and correlates of precautionary behaviour related to human avian influenza during 2006 -2007 in the Netherlands: results of seven consecutive surveys
a1ffb2fbd3396e59c4cd1f85e6ac3e127b50862e.json,Effectiveness of Border Screening for Detecting Influenza in Arriving Airline Travelers
46d3b2026ee17e7cb37420a748bb33092363c341.json,China's capacity of hospitals to deal with infectious diseases in the context of climate change
377d8d4560cb8cca5ca75e49f9f5be8047c767ea.json,Predictors of symptoms of posttraumatic stress in Chinese university students during the 2009 H1N1 influenza pandemic
dc42754f70bfa4352dc52a257343ae56db0584a6.json,Impacts of rapid flu clinic services at an emergency department during the pandemic flu season
53f7ce0a18de7792f478273f9449e175960563c0.json,Practice of habitual and volitional health behaviors to prevent severe acute respiratory syndrome among Chinese adolescents in Hong Kong
b0266f266faec7f1d36cb2af9d03e9ace2ee1cb2.json,Factors influencing the adherence of nurses to standard precautions in South Korea hospital settings
77df12a2ea42f8702db5b87396eebc49d3d13085.json,Estimating the burden of influenza-associated hospitalization and deaths in Oman (2012-2015) Background: Influenza is a serious vaccine-preventable disease with high incidence
caadc408ff1144a53369c7e0f63634ff264be9ee.json,Evaluation of a new community-based curriculum in disaster medicine for undergraduates
03482e6a876292352f7aaf1cceeb848e28fb973e.json,Estimating Preventable COVID19 Infections Related to Elective Outpatient Surgery in Washington State: A Quantitative Model
32ffbe671caf791831bb7516b550b4b27240a5f0.json,Factors associated with recovery delay in a sample of patients diagnosed by MERS-CoV rRT-PCR: A Saudi Arabian multicenter retrospective study
b53f3fa13a84fed43c6314ae35e98f59eb54c9e9.json,On-farm biosecurity as perceived by professionals visiting Swedish farms
b8797e77d9c91dd2cab19ba2e67cf32b6dd97bf6.json,Supporting Information 2 -Summary information from articles included in systematic literature review
32edd4b65bdde3b8ff503a48fc9f46d715687409.json,The Effect of Hospital Isolation Precautions on Patient Outcomes and Cost of Care: A Multi-Site
a126c62ed8ff8781b618d13b3b1127fde81076f8.json,Emerging Microbes & Infections (2017) 6
720937e57c7f2604c9ab4c653dafe12b73e9f63f.json,Improving older adults' knowledge and practice of preventive measures through a telephone health education during the SARS epidemic in Hong Kong: A pilot study
17d92d371f5552921b86de6fb6cd7e65344ddb2e.json,Epidemiology and Health Preventive behaviors by the level of perceived infection sensitivity during the Korea outbreak of Middle East Respiratory Syndrome in 2015
aff980a3b552e184251a190f2f50f4507a92087b.json,Articles Chronic obstructive pulmonary disease in China: a nationwide prevalence study
8bbed9ba58648bf7cb018371aea8e030a999873d.json,Primary care physicians' response to pandemic influenza in Hong Kong: a mixed quantitative and qualitative study
6f048749badc8f1c756857ceb24421f5e6c05e62.json,BMC Public Health Patterns of perception toward influenza pandemic among the front-line responsible health personnel in southern Thailand: a Q methodology approach
afe796b836e9b44e03fcfc7a644c62c3aa70a5f0.json,Lau et al: Randomised trial of an exercise program for patients recovering from SARS A randomised controlled trial of the effectiveness of an exercise training program in patients recovering from severe acute respiratory syndrome
347209baac4ddbcc1533979d1a496128d7834f5e.json,Public knowledge and preventive behavior during a large-scale Salmonella outbreak: results from an online survey in the Netherlands
ab50cf0159a56f447825137b6100ce061f2a745a.json,Print Media Response to SARS in New Zealand
bd6a6cd1c453c47af156f6e42ba837207ab45c63.json,Middle East Respiratory Syndrome Coronavirus Outbreak in the Republic of Korea
55979053155d23695332812081b4e805cf1cabd7.json,Health Care Facility and Community Strategies for Patient Care Surge Capacity
d2e50891500031a482f95969c3657a6ef253b22a.json,Social Factors Associated with AIDS and SARS
85ea42a51940dccec33a419fb7a3922f811fa263.json,Hindsight: A re-analysis of the severe acute respiratory syndrome outbreak in Beijing
cd9b28a218d57ae7506637d96b2a396dca870e0f.json,The Burden of Influenza-Associated Hospitalizations in Oman
8a503b9616f3c0a70de136a65b2e35d276f511a2.json,The severe acute respiratory syndrome: Impact on travel and tourism
6e7a149e8ef34d3b89a8c908d7bdd5a2cae55b10.json,RACE
4e9ac9796e3e427edc1bf067906b80e1b211fb85.json,Homelessness and the Response to Emerging Infectious Disease Outbreaks: Lessons from SARS
417a6772d67e3b958d27a80ed09cabfea228d432.json,Impact of 2013 south Asian haze crisis: study of physical and psychological symptoms and perceived dangerousness of pollution level
447d470180f96efea97552434d3b470a82c1772a.json,Outcome of strict implementation of infection prevention control measures during an outbreak of Middle East respiratory syndrome
f9d125910f476ccc975921c0b2b39c096379cf32.json,Psychiatric-Medical Comorbidity Long-term psychiatric morbidities among SARS survivors
367aa0244a4b97d04590b92ba9dba13fccd07ce3.json,Evaluation of the influenza sentinel surveillance system in the Democratic Republic of Congo
7ab746402189d8abc638ed8b61d88ee8fb1df7ac.json,OBSERVATION: BRIEF RESEARCH REPORT Knowledge and Perceptions of COVID-19 Among the General Public in the United States and the United Kingdom: A Cross-sectional Online Survey Annals of Internal Medicine LETTERS
0faea8445e96457c63aa5ac80ed6b13b08c2e992.json,Inpatient Capacity at Children's Hospitals during Pandemic (H1N1) 2009 Outbreak
a40b6e56c56c9aab8db969e97b2d7b92060fcd7d.json,Establishing research priorities to improve the One Health efficacy of Australian general practitioners and veterinarians with regard to zoonoses: A modified Delphi survey
8bf581553621ca6dd31516239bb2edb5389d6a30.json,Variation in health care worker removal of personal protective equipment
ebcf50109d87df47c19b0b77401848dd855a12da.json,Impact of mental health and caregiver burden on family caregivers' physical health
168667e863cc79cb44157edf0e39ca66a37b2b7b.json,Contact among healthcare workers in the hospital setting: developing the evidence base for innovative approaches to infection control
6efde6b65a96f7b14d75d637f5dd77f8e6e1c51c.json,Taipei's Use of a Multi-Channel Mass Risk Communication Program to Rapidly Reverse an Epidemic of Highly Communicable Disease
aa96296a83b9395223f9a9b1b116f50ae8bcdb11.json,Relationship between hospital ward design and healthcare-associated infection rates: a systematic review and meta-analysis
84ef152ba76ced39a6ab7f082895541c1b3ea9ec.json,Household preparedness for emergency events: a cross-sectional survey on residents in four regions of China
d855c6cd2ea18541bdcd39ef33e5158c5215dbb3.json,The risk factors associated with MERS-CoV patient fatality: A global survey
7636da046a6bdf1033f9078671187e65e0e231d9.json,Body surface infrared thermometry in patients with central venous cateter-related infections Termometria infravermelha da superfície corporal em pacientes com infecção relacionada a cateter venoso central
824c796362a0fd9fc522f6c5ea1f84ba9f2b5b83.json,The impact of the COVID-19 epidemic on the utilization of emergency dental services
c7d87ef17e8863714b7ccd091373777918e9131d.json,Intensive Care
c6e819e9d3fdfd19cafd2ddf160b9ed2cfd9a27a.json,BMC Public Health Public perceptions of quarantine: community-based telephone survey following an infectious disease outbreak
754315299d847600d6c5d414665c728d40bf731d.json,Breaking down of healthcare system: Mathematical modelling for controlling the novel coronavirus (2019-nCoV) outbreak in Wuhan
95c98cb73d589ef83f73d136efb236e91c7b696d.json,Identifying and Addressing the Daily Needs of Contacts of an Ebola Patient During Investigation
289deae0b2050aa259a05ba84565a4df82fa099a.json,Personal Protective Equipment: Protecting Health Care Providers in an Ebola Outbreak
ec4deb95095d0a80cf7f0568e77c6f7ea545a32b.json,Methodologies for measuring travelers' risk perception of infectious diseases: A systematic review
affa4df43665fb042bffde141c288050aa99ed47.json,Defense Threat Reduction Agency
12211928107a51f2c249c575ea1d923a0a74b88e.json,Barriers to implementing infection prevention and control guidelines during crises: Experiences of health care professionals
408e677725167e4c45863aab7d91de0a5dae6d22.json,Communicating uncertainty -how Australian television reported H1N1 risk in 2009: a content analysis
4891e50b4ad9839f12a436a602c52ed0d2ad883f.json,Preparing for a Surge of Coron-avirus Cases
b3f09b17292174df45038e948403a95a6b757620.json,Epidemiology of severe cases of influenza and other acute respiratory infections in the Eastern
ef06f0c970186bd8458ec76036febd61d6e64939.json,ScienceDirect General review Hajj-associated infections ଝ Infections liées au Hadj
231ba154ea0d9a668c5c5e7e5732c4f223608f6d.json,PEER REVIEW HISTORY
52c10207ba9098e1f733dbb84c796bd321b33eb0.json,P a g e Screening and managing of suspected or confirmed novel coronavirus (COVID-19) patients: experiences from a tertiary hospital outside Hubei province
7a45245eab239a29ec8a3812238e1be30d3ee107.json,Reporting ethics committee approval and patient consent by study design in five general medical journals
735c88a4c5b6d4ce37707bfb66a38a410443c8a3.json,Your Health Essential for Your Hajj: Muslim pilgrims' knowledge
dbb9370ee4e86a2f0024e497d9a5b727924cbe43.json,Was SARS a mental health catastrophe?
ce0ea5e3b418366d8dab2a4c5a98266c8880a156.json,2018 @ERStalk Project rationale
eed4a68d4e44f9887b3219ad5813eed5f0c4d42b.json,A Randomised Controlled Trial of Face Masks and Hand Hygiene in Reducing Influenza Transmission in Households
9231e9d6dd98dca26e67eaf02eea8c0ad0bcce3b.json,The impact of unplanned school closure on children's social contact: Rapid evidence review
792bf7a5d0d3d88b96005f794366d3419f692f04.json,Managing Clinical Risk and Measuring Participants' Perceptions of the Clinical Research Process
eb682a5cbe2942e78f0ec4959adce8475d5723d5.json,British Columbia Ministry of Health
ffe663e4ef5018da41f057533520b9d85ec86e18.json,Global Variability in Reported Mortality for Critical Illness during the 2009-10 Influenza A(H1N1) Pandemic: A Systematic Review and Meta-Regression to Guide Reporting of Outcomes during Disease Outbreaks Influenza A(H1N1) Pandemic: A Systematic Review and Meta- Regression to Guide Reporting of Outcomes during Disease Outbreaks
015c335c8cb9e5eabb352e81c0f38bf6f781b202.json,Validation of three geolocation strategies for health-facility attendees for research and public health surveillance in a rural setting in western Kenya
5d76f48664d2e90c67768d51a2efda3e12c316ce.json,Southern Hemisphere Influenza and Vaccine Effectiveness Research and Surveillance
4f7e3be54c93d119c3a1ddb753aa5394878a2bbe.json,Avoiding student infection during a Middle East respiratory syndrome (MERS) outbreak: a single medical school experience
1575931c6fe7aea67ea3ced0ebe1df4d2604864c.json,Protocol (version 4 3/7/2009) 1. Title: A PRImary care trial of a website based Infection control intervention to Modify Influenza-like illness and respiratory infection Transmission (1.2 Acronym PRIMIT trial.) 2. 1
7da1a3651e1aba73bc607cf4aaa93105af0c2bf7.json,Calculating the burden of disease of avian-origin H7N9 infections in China
befd47f9dd7e050dcd46f483ca8e7bd902f4707f.json,A Comparative Study of Clinical Presentation and Risk Factors for Adverse Outcome in Patients Hospitalised with Acute Respiratory Disease Due to MERS Coronavirus or Other Causes
9211b1703c76e20afdee8fcb9f7996edadef0e9e.json,Awareness of MERS-CoV among Staff Members of Prince Sultan Military Medical City in Riyadh
2b6ea0603deab65ea1e0ddf4367985f6061bac9b.json,Social contact patterns relevant to the spread of respiratory infectious diseases in Hong Kong
d75c48f51b2a5c26a41fe615339e5947d5e9cb30.json,Analysis of epidemiological characteristics of coronavirus 2019 infection and preventive measures in Shenzhen China-a heavy population city
3ed1483725e4ea6abcdbf93585eeccde903202fd.json,EPIDEMIOLOGIC INVESTIGATION The first case of the 2015 Korean Middle East Respiratory Syndrome outbreak
abd0e6035c35ae69ff4b932653755a22425e47eb.json,Middle East respiratory syndrome coronavirus (MERS-CoV): Prevention in travelers
ee1c20d3d0762e07830b93f37313b5549c08dc25.json,Management of Patient Flow in Vascular and Interventional Radiology During MERS-CoV Outbreak
94a0e2649e6d5562289cffc857fdd3b7c9d608a5.json,Effects of a SARS prevention programme in Taiwan on nursing staff's anxiety
48545476b719bbb0efc851c4bb4da881b8244cc2.json,RANDOMISED CONTROLLED TRIAL OF RHINOTHERMY FOR TREATMENT OF THE COMMON COLD RANDOMISED CONTROLLED TRIAL OF RHINOTHERMY FOR TREATMENT OF THE COMMON COLD
83b5515d625870701aa3a38e487fec3fbe56ac16.json,Evidence-Based Point-of-Care Device Design for Emergency and Disaster Care NIH Public Access
56e55320ccc4c59dcb76503f4fa2e31976c9eefd.json,Handwashing practice and the use of personal protective equipment among medical students after the SARS epidemic in Hong Kong
f71f404e3e9c23e9131bbd016c076da25e8e0276.json,Eff ect of the Ebola-virus-disease epidemic on malaria case management in Guinea
eef61bdfa49b8652fd660b5b8b7e74cf51922505.json,Changes in pulmonary tuberculosis prevalence: evidence from the 2010 population survey in a populous province of China
03f7d2452890b8b38bd91208ff5dc094b70d16ce.json,Moving beyond hand hygiene monitoring as a marker of infection prevention performance: Development of a tailored infection control continuous quality improvement tool
209136e8f27406f9c9e1321c7e62aaa83b05c68a.json,| Division of International Cooperation
6ab996d18f7972a5776e22818af27d66445e9c7d.json,Management Guidelines for Obstetric Patients and Neonates Born to Mothers With Suspected or Probable Severe Acute Respiratory Syndrome (SARS)
34190b8df3ed825e3c49e41a3782d04acf1e21e9.json,Emergency department triage: an ethical analysis
79e2bca32a1b8f6b9d2268838a84222bfdac4fc2.json,Health careeassociated infection outbreaks in pediatric long-term care facilities
f4c7da2c6eb641d6c76db9f8220b3f0c01850874.json,Open Access 2015 MERS outbreak in Korea: hospital-to-hospital transmission
9f7ed2037968c63fa97eb6fc7c35e9738a654541.json,BMC Public Health Gender difference in knowledge of tuberculosis and associated health-care seeking behaviors: a cross-sectional study in a rural area of China
7ea18d0f1f48881cc0a582309845fd56b92fd88e.json,Unusual presentation of Middle East respiratory syndrome coronavirus leading to a large outbreak in Riyadh during 2017
fda652236c27077e6b119b4a389f44e4fe42ce2f.json,Impact of enhanced infection control procedures on clinical outcome following resuscitation attempts
a699cfdfda9ccc5ccb41e946a63113106b39148d.json,Factors Associated with Increased Risk Perception of Pandemic Influenza in Australia
c6463593f45c19d4989336f52905704d1ec9b74e.json,The Influence of Social-Cognitive Factors on Personal Hygiene Practices to Protect Against Influenzas: Using Modelling to Compare Avian A/H5N1 and 2009 Pandemic A/H1N1 Influenzas in Hong Kong
16673eca9ff4c1f57f53126415ad2f89b8cab557.json,Human temperatures for syndromic surveillance in the emergency department: data from the autumn wave of the 2009 swine flu (H1N1) pandemic and a seasonal influenza outbreak
899c5959f51505b0935e46c2e77129156026806e.json,Establishment and evaluation of a theater influenza monitoring platform
555559ac51210f5ee896ad5d45a6790d52a3e4d1.json,Determinants of emergency response responsibility perceptions in the local public health workforce after China's health sector restructuring
2afcf2ab2330cb56ec493f82d87fa0c5b5f076e9.json,BMC Medical Informatics and Decision Making Improving antibiotic prescribing for adults with community acquired pneumonia: Does a computerised decision support system achieve more than academic detailing alone? -a time series analysis
04e9538cac86bafa7563fc75f3d4f17e9d918e35.json,Closure of medical departments during nosocomial outbreaks: data from a systematic analysis of the literature
2f5020d7b6407c345a869d3eac7b675fbc95c170.json,The power of detention in the management of non-compliance with tuberculosis treatment: A survey of Irish practitioners and analysis of potential legal liability
b419ea900da16b40a8ae3316c9828371607c3c4f.json,Maternal anxiety and feelings of control during labour: A study of Chinese first-time pregnant women
f39c5ac8e65239e47d96a8b0613295ff9cfd8710.json,Common infection control practices in the emergency department: A literature review
e7244d41e892e5256f9a90a7065827777d603120.json,Factors influencing disaster nursing core competencies of emergency nurses
77efa10bbf0d22795315f61ace2dc95804d269fb.json,Analysis of psychological state and clinical psychological intervention model of patients with COVID-19 Running Title: Psychological state and intervention model in COVID-19 patients
84da44d2366d3f082d0ec30cbaff70807ca732c7.json,Perception and Performance of Preventive Behaviors for the Pandemic Influenza in Hospital Employees and Outpatients
e5950224763279c0e77c08e0d8853a33923fc8f5.json,Preparing the Intensive Care Unit for Disaster Preparing the ICU for Disaster
8cce38ec95e39b906c5b709462a6077fe9656f71.json,Emergency Department Design
7a14c9ee046c688ac5c625f6e62f15f188c3d9ef.json,Is hand hygiene frequency associated with the onset of outbreaks in pediatric long-term care?
3f75777da1f595e72a9e488a39bbc8c55f0af672.json,Effect of single-versus double-gloving on virus transfer to health care workers' skin and clothing during removal of personal protective equipment
6afa8c5639ac39717e68778d7637ac300fe4c2e2.json,Middle East respiratory syndrome coronavirus transmission among health care workers: Implication for infection control
14597dad9c71c07579c0a5e5e9878aa1c003f50e.json,Comparative Epidemiology of Human Fatal Infections with Novel
373474bd0d2c88363e7fad85fa0ca0863687a791.json,Author affi liations: University of North Carolina Health Care Sys-tem
3f1dd22fd366efca2448379f7becf69de113353a.json,Randomized
039d54d27f209eb69b76607a2e8e93a6a42fae47.json,Caring for a Surge of Hurricane Katrina Evacuees in Primary Care Clinics
d308690b94821056311b8fe89edc85245a3afe13.json,23 Response to SARS as a prototype for bioterrorism: Lessons in a Regional Hospital in Hong Kong
c25e786759a5c261fed053aeeb9298e36b8aed17.json,Noise and Room Acoustic Conditions in a Address for correspondence
2735c2e5b493fd4e7b7c4ec3d44a775f9399aa0d.json,Enhancing Time-Series Detection Algorithms for Automated Biosurveillance
1c616a84b4f9479c22a6094bd19a26fd85134b59.json,The relevance of psychosocial variables and working conditions in predicting nurses' coping strategies during the SARS crisis: An online questionnaire survey
fc7c8a3a08f76f4b5214731a1997e515fdc3a6d8.json,Administration of Emergency Medicine AN INTERVENTION TO IMPROVE COMPLIANCE WITH TRANSMISSION PRECAUTIONS FOR INFLUENZA IN THE EMERGENCY DEPARTMENT: SUCCESSES AND CHALLENGES
09e29610427ec5c1d3dd8fab6571c8168087f190.json,Are health care workers protected? An observational study of selection and removal of personal protective equipment in Canadian acute care hospitals
85034882a31e894144a9e118489ea3a5dc0e33c3.json,Policy & practice Risk and outbreak communication: lessons from alternative paradigms
b2a85eaad193272ba43b5dc178a1f7b6e8c26069.json,Knowledge and practices of isolation precautions among nurses in Jordan
