file,title
6ca67d203ed9f4870c85f2289d62ee3c498b5a13.json,Imaging analysis of human metapneumovirus- infected cells provides evidence for the involvement of F-actin and the raft-lipid microdomains in virus morphogenesis
1d248662489af078d3060a053add4865000a94e1.json,Brief Reports Lipopolysaccharide Inhibits Sindbis Virus-Induced IP-10 Release in Human Peripheral Blood Mononuclear Cells
30e4b834f1684fcc9ba26d41316a44b90aa287a6.json,Virology Journal G0/G1 arrest and apoptosis induced by SARS-CoV 3b protein in transfected cells
87931634ba2b81eacf109a8fecb0033d54fe43b8.json,The nsP3 Macro Domain is Important for Sindbis Virus Replication in Neurons and Neurovirulence in Mice
af547c43638857c71c035fa4217e167f681f837c.json,Effective inhibition of MERS-CoV infection by resveratrol
631c92f10837ef3a7e8838f2eb19cf2f8c5d74de.json,Porcine sapelovirus enters PK-15 cells via caveolae-dependent endocytosis and requires Rab7 and Rab11
a307a8f5128e75d273b9d0017c7b24a40fa3c641.json,Cell-surface processing of extracellular human immunodeficiency virus type 1 Vpr by proprotein convertases
2bf3f075175c307923fc400707b30616a676419c.json,The Ubiquitin Proteasome System Plays a Role in Venezuelan Equine Encephalitis Virus Infection
d3669fc36015db30aaecba5e7d608584d9a2cdfa.json,Article 1843-L (2019) Influenza Virus-Induced Robust Expression of SOCS3 Contributes to Excessive Production of IL-6
d31b2db65b2e8d40eee096d5e67185099c10c4d2.json,Basal Autophagy Is Required for Herpes simplex Virus-2 Infection OPEN
8e3f518b27782ac9cc19e7556d74100ff23d972b.json,Porcine parvovirus infection activates mitochondria-mediated apoptotic signaling pathway by inducing ROS accumulation
35f87b9cc72a9beeb05dc649742ce334db48c854.json,Global profiling of megalocytivirus-induced proteins in tongue sole (Cynoglossus semilaevis) spleen identifies cellular processes essential to viral infection
47826d4f9693f8859eff729ef432cc24d41cd896.json,Technologies for Proteome-Wide Discovery of Extracellular Host-Pathogen Interactions
c41cd165529d51d5418e2628ceda43970f8ca399.json,Evidence that Gag facilitates HIV-1 envelope association both in GPI-enriched plasma membrane and detergent resistant membranes and facilitates envelope incorporation onto virions in primary CD4 + T cells
3e86a490327b0f473d776363d3f2e67ddd04d681.json,Human Kinase/Phosphatase-Wide RNAi Screening Identified Checkpoint Kinase 2 as a Cellular Factor Facilitating Japanese Encephalitis Virus Infection
1bebd833b3535712b5d13f9ed985e3491d3c96c8.json,Chloroquine Inhibits Dengue Virus Type 2 Replication in Vero Cells but Not in C6/36 Cells
d0a747c6e7bcbba0cf55a4924cc16dfda463dbb9.json,Broad-spectrum antiviral activity of the eIF4A inhibitor silvestrol against corona-and picornaviruses
c8b8739a92fc28f48899df96c807dc17e1e6fc8e.json,NS5B induces up-regulation of the BH3-only protein
88395bf2fdca68c0eb033b14655275547bdcd714.json,Comparative analysis of the activation of unfolded protein response by spike proteins of severe acute respiratory syndrome coronavirus and human coronavirus HKU1
b298992d7feb9dd3d23192572f975abdf2cebc0a.json,Treatment with proteasome inhibitor bortezomib decreases organic anion transporting polypeptide (OATP) 1B3- mediated transport in a substrate-dependent manner
99aeb8b55ac9d8282748592dbc88304d1edcfebc.json,Triggering unfolded protein response by 2-Deoxy-D-glucose inhibits porcine epidemic diarrhea virus propagation
2b91f521c12a736203029e85675120740c3c1810.json,Lack of Innate Interferon Responses during SARS Coronavirus Infection in a Vaccination and Reinfection Ferret Model
0c5206034c8face2f7b52c5529cb67eaeb7bc8c4.json,Diversification of importin-α isoforms in cellular trafficking and disease states
c3b2ffe3406f733818a11f02fd783e0e2a710244.json,The roles of cytosolic quality control proteins
b41c0d4da1cbf48ae32e94f6e2c2918cb0cb6dd5.json,MERS-CoV papain-like protease has deISGylating and deubiquitinating activities
dfa3dbdc7b28b9075361efcb919d3a1b19636edd.json,Emerging roles of interferon-stimulated genes in the innate immune response to hepatitis C virus infection
a73d97226cb958a94cd359666b35e092452818b7.json,Chlamydia trachomatis Co-opts GBF1 and CERT to Acquire Host Sphingomyelin for Distinct Roles during Intracellular Development
84bf3b3e1716be122763fef2463f88970a8306d9.json,Ebola Virion Attachment and Entry into Human Macrophages Profoundly Effects Early Cellular Gene Expression
538541309ebfacef27f87f277b5438344f5bfeb1.json,Antiviral effect of lithium chloride on infection of cells by porcine parvovirus
9006f3d3976269e8282ac303c17acc99a59c2893.json,A single-amino acid substitution in West Nile virus 2K peptide between NS4A and NS4B confers resistance to lycorine
5c533a06c3dc5afefab5dd138ec4de394b537261.json,Role of the Spike Glycoprotein of Human Middle East Respiratory Syndrome Coronavirus (MERS-CoV) in Virus Entry and Syncytia Formation
4c867f9bd7a6d2488d1636d456844ee6bf620390.json,Proteasome Inhibitors Enhance Bacteriophage Lambda (λ) Mediated Gene Transfer in Mammalian Cells
2e3d6708bedf2af3d3b900329871c910308b0b7a.json,Identification of Human Junctional Adhesion Molecule 1 as a Functional Receptor for the Hom-1 Calicivirus on Human Cells
0b9249faf42463eb8673c8635f33c34c5d8a8bfb.json,The role of C/EBPβ phosphorylation in modulating membrane phospholipids repairing in LPS-induced human lung/bronchial epithelial cells
fae8f01ff5ef7b1737b60dfba0e183bdf482aaba.json,Species-specific vulnerability of RanBP2 shaped the evolution of SIV as it transmitted in African apes
c8f9c5d7e30e601b4ea6e3c42696177c57aa1c47.json,Viral Appropriation: Laying Claim to Host Nuclear Transport Machinery
bf69fd53137145200ca5393dbf2c3c57c60f1255.json,Influenza entry pathways in polarized MDCK cells
01b74c8f488cbed1b308456532cf1a15c0e844a9.json,Porcine reproductive and respiratory syndrome virus (PRRSV) could be sensed by professional beta interferon-producing system and had mechanisms to inhibit this action in MARC-145 cells
566bdd537595b38dc6ab764b13d6d9ae33f9c9af.json,Mouse Hepatitis Coronavirus RNA Replication Depends on GBF1-Mediated ARF1 Activation
73fcc68f1fe5bf9cae21d939f459968ebed64411.json,Hepatitis C Virus Core Protein Promotes miR- 122 Destabilization by Inhibiting GLD-2
9daf3c23f039656f1db8863336ac86ef9fb6f6ab.json,Infection on a chip: a microscale platform for simple and sensitive cell-based virus assays
d9c9f9f03cb93fd7ddd3f409d8948f0ecf30445e.json,Ribosomal stress and Tp53- mediated neuronal apoptosis in response to capsid protein of the Zika virus OPEN
1986e96f2be6bd012fcd4d0b731caf62c7a4dea2.json,Relevance of Viroporin Ion Channel Activity on Viral Replication and Pathogenesis
500c5ea0961b573ba5355d364ca94c00a0a26e4a.json,The dengue virus non-structural protein 1 (NS1) is secreted from mosquito 2 cells in association with the intracellular cholesterol transporter chaperone
9b8a2314912eaeb1c509cf88492f463148a0a9ed.json,The nucleocapsid proteins of mouse hepatitis virus and severe acute respiratory syndrome coronavirus share the same IFN-β antagonizing mechanism: attenuation of PACT-mediated RIG-I/ MDA5 activation
64e2d8f1f9eccda51fa3b8398c20e040c7fbcd06.json,Lycorine reduces mortality of human enterovirus 71-infected mice by inhibiting virus replication
1a80ce2336e72d0e9283afaf12e5d25255f4984e.json,The antiviral effect of interferon-beta against SARS-Coronavirus is not mediated by MxA protein
af0442df28de9051b460e903b513afc2a13b54a4.json,Supplemental Information The FDA-Approved Oral Drug Nitazoxanide Amplifies Host Antiviral Responses and Inhibits Ebola Virus
ffa9ed5ecad1dcbc3d25ec598402640e4bab10f4.json,Nuclear localization signal in TRIM22 is essential for inhibition of type 2 porcine reproductive and respiratory syndrome virus replication in MARC-145 cells
8213f353876b2eba6110eae70dae057a2f08b93f.json,Long noncoding RNAs (lncRNAs) dynamics evidence immunomodulation during ISAV- Infected Atlantic salmon (Salmo salar) OPEN
315f0a94d6ac0655e0e5defec4f9526641c76037.json,Role of rhesus macaque IFITM3(2) in simian immunodeficiency virus infection of macaques
dc46a9c2a3b3f5f7f3b6650c6fba4369a2793cd2.json,Supplementary Information 1 2 The Golgi associated ERI3 is a Flavivirus-specific host factor for Dengue virus 3 4
555749866b1f567f15e4c0068658566f2bbfa4e9.json,EF1A interacting with nucleocapsid protein of transmissible gastroenteritis coronavirus and plays a role in virus replication
6b2cdea95cd8c0134c69cc5fb592bb113768dd2f.json,Targeting the viral Achilles' heel: recognition of 5 0 -triphosphate RNA in innate anti-viral defence
a98cb78560aeea0f7e3e21df8359a9430ffce55d.json,The Intracellular Cargo Receptor ERGIC-53 Is Required for the Production of Infectious Arenavirus
4ebe630a2d802a7d6f2402a88c3dc88e7497dcfd.json,The Author(s)
3941bfed937029a31746847f195aeb98631f8d0d.json,Function of Membrane Rafts in Viral Lifecycles and Host Cellular Response
7c92eb9f2f7fd93501102671ee6595e0b157383d.json,RNA The Structure-To-Function Relationships of Gammaherpesvirus-Encoded Long Non-Coding RNAs and Their Contributions to Viral Pathogenesis
822f91b5238e03eeeb14c3e15fa67d86f66b2e64.json,lncRNA expression signatures in response to enterovirus 71 infection
a8ddea0a1b578a5866bf204ff4450f902fb48829.json,Hypothesis links emergence of chloroquine-resistant malaria and other intracellular pathogens and suggests a new strategy for treatment of diseases caused by intracellular parasites
4ee2232fd9b2088955ad781243f135dc76edbaf1.json,Endoplasmic Reticulum Stress Contributes to Helicobacter Pylori VacA-Induced Apoptosis
6f07c83e4725e356c064b0f3f882699f59335282.json,Previews Circle the Wagons: Circular RNAs Control Innate Immunity
f746c812c39e7685944fa61ecbec816b684415c1.json,Establishment of an immunoscreening system using recombinant VP1 protein for the isolation of a monoclonal antibody that blocks JC virus infection
4bd13f74473634bf6cd1384033cefc9ffbbc8a7a.json,Interaction of SARS and MERS Coronaviruses with the Antiviral Interferon Response
3b03099c01cf7b85794e43e17eaf5a2d28ccf9da.json,Cyclophilin A and viral infections
4b3ddd160ebda77b58843d167709d71a73a3bf4a.json,Legume Lectins Inhibit Human Parainfluenza Virus Type 2 Infection by Interfering with the Entry
068f7225f65e0ce09a8ea4337416f186807ff3ee.json,Infection on a chip: a microscale platform for simple and sensitive cell-based virus assays
fe2000f280297c40bc53ce95d703a9ca6aac19fd.json,Differential Regulation of Type I Interferon and Epidermal Growth Factor Pathways by a Human Respirovirus Virulence Factor
645d7cddbca3447f8a1befabc5d775a38bb7854a.json,SARS coronavirus accessory proteins
9a166cd00e5f345628b409d989af5efdeb4a35d0.json,A natural tetranortriterpenoid with immunomodulating properties as a potential anti-HSV agent
8c4233100da83790ea6544851b543977da15a4ca.json,Susceptibility to Cytotoxic T Lymphocyte-induced Apoptosis Is a Function of the Proliferative Status of the Target
92c932118ed311b25d35527281e7b8568aeb2dcf.json,viruses Suppression of NF-κB Activity: A Viral Immune Evasion Mechanism
25b38d2f44283253d1e8d320c8389c069c5ae906.json,HIV-1 and Its gp120 Inhibits the Influenza A(H1N1)pdm09 Life Cycle in an IFITM3-Dependent Fashion
c6ee7a7a69e09890468e829369f3c3e8434a7f23.json,Proteomic analysis by iTRAQ in red claw crayfish
aec5782dbbe2413770cec1f6485b4015ca0ebdc1.json,Interplay between viruses and host mRNA degradation ☆
42085d63b0fbfc03c555626cadd11d55774c5c64.json,Immune function of an angiotensin-converting enzyme against Rice stripe virus infection in a vector insect
693d0f533004851d03a1f38a336f6aa943ea2733.json,Up-Regulation of Mcl-1 and Bak by Coronavirus Infection of Human
963be414e23794b5cb5f6ec9b1fec592792c25eb.json,The Rate of Hepatitis C Virus Infection Initiation in vitro is Directly Related to Particle Density
ba63294c4ff5f5a55e21e564d7af96c7ec6ed9a7.json,RNA interference inhibits hepatitis E virus mRNA accumulation and protein synthesis in vitro
8397db5938687c5e7758d30c3fb75aba0237f3cc.json,Transmissible gastroenteritis virus N protein causes endoplasmic reticulum stress
96456a955d56878dc1e53c0feeb14bf307518b17.json,Programmed Ribosomal Frameshift Alters Expression of West Nile Virus Genes and Facilitates Virus Replication in Birds and Mosquitoes
fd1dd9494d62b3248137dbd4f09ba0c2d200f612.json,Transmissible gastroenteritis virus infection induces cell cycle arrest at S and G2/M phases via p53-dependent pathway
9313219675ddfa18b0667b701433123acc3c39da.json,TRIM56-mediated monoubiquitination of cGAS for cytosolic DNA sensing
372caa549b07492de5fd7064e9cadc62bef0f478.json,Article 211 Citation: Zhao C and Zhao W (2020) NLRP3 Inflammasome-A Key Player in Antiviral Responses
e7910acd7e2772df933ee8161c68baf67cc4991d.json,Ultrastructural Localization and Molecular Associations of HCV Capsid Protein in
09ec8daa8e32168d92d05b86de1784c639685fb4.json,The influenza A virus endoribonuclease PA-X usurps host mRNA processing machinery to 1 limit host gene expression 2 3
f4aa788ab898b28b00ee103e4d4ab24a2c684caf.json,Venezuelan Equine Encephalitis Virus Induces Apoptosis through the Unfolded Protein Response Activation of EGR1
afaa73edec3f6944af5018e8426d3333d3a9986a.json,The Journal of Infectious Diseases Autophagy-Associated Proteins Control Ebola Virus Internalization Into Host Cells
5a2d0804fc8a4c5d6c661deca4e3150e5cbc77d5.json,The lifecycle of the Ebola virus in host cells
2005ffa70562f5f03b57f0d19f4d63e807762964.json,MINI REVIEW Bovine Herpesvirus 1 Counteracts Immune Responses and Immune-Surveillance to Enhance Pathogenesis and Virus Transmission
d1757146383c42ebfb3f6318f2fd63dc1b43f1fe.json,Dynamic Expression of Interferon Lambda Regulated Genes in Primary Fibroblasts and Immune Organs of the Chicken
7f796fc1f34c8e45bc773c7f0f7f982b750f7957.json,Binding interaction of SARS coronavirus 3CL pro protease with vacuolar-H + ATPase G1 subunit
124d50f8e6f06f11cf9cf6349558d601790cdc34.json,Inhibition of Hepatitis C Virus Infection in Cell Culture by Small Interfering RNAs
4edda548e89522b4df20e723e29c63f309857b10.json,Cell Host Response to Infection with Novel Human Coronavirus EMC Predicts Potential Antivirals and Important Differences with SARS Coronavirus
37bc284af4f2f731792f44339253abc79c6d2782.json,Host and viral Modulation of RiG-i-Mediated Antiviral immunity
151b02058c333bd1e01af6f1feebbf77f42fd30c.json,Accelerated induction of apoptosis in insect cells by baculovirus-expressed SARS-CoV membrane protein
da0342ac2f74af964ce1a72731bfec7d7d0a483e.json,Tyrosine dephosphorylation of STAT3 in SARS coronavirus-infected Vero E6 cells
96aaf04cd17ae7c92f976a072d4352d1d3aca94f.json,PP2-196 Nonstructural protein 4B of hepatitis C virus inhibits interferon responses Role of fusion activity in cross-presentation of influenza nucleoprotein- derived antigens
08741b63c08d63c1a86dd3ef3ce3d1bfd39e560b.json,Dissection and integration of the autophagy signaling network initiated by bluetongue virus infection: crucial candidates ERK1/2
7ad4e285ccc9da0fc8c9507818012f121ec9436d.json,Drug Delivery-mediated Control of RNA Immunostimulation Delivery-mediated Control of RNA Immunostimulation
740523d9e53ac786c0a45c790320c219cd0031a4.json,MAVS-MKK7-JNK2 Defines a Novel Apoptotic Signaling Pathway during Viral Infection
cefbe0e7441f96ec3d0a08e9d7f291dbcf44f4e3.json,Interferon α Induces the Apoptosis of Cervical Cancer HeLa Cells by Activating both the Intrinsic Mitochondrial Pathway and Endoplasmic Reticulum Stress-Induced Pathway
80637e7403f730cb2e22a4af53fade48a1e42a87.json,The highly conserved 5' untranslated region as an effective target towards the inhibition of Enterovirus 71 replication by unmodified and appropriate 2'-modified siRNAs
a4995af42a012dd1b7f8da3936d79d78d0e24405.json,Key project of National Natural Science Funds from National Natural Science Foundation of China
c2510fbc213aa74c6c3195cbc8033c7d0f11b248.json,Deoxynivalenol Promotes Porcine Epidemic Diarrhea Virus Infection and 2 Aggravates Gut Barrier Injury
5d0f353b8581c16ead66fbc58ec16c0a6ff8777d.json,Cell-based antiviral screening against coronaviruses: Developing virus-specific and broad-spectrum inhibitors
0a789bc7f1713d549288d3effb72ff34cd3b0ab0.json,Respiratory syncytial virus (RSV) entry is inhibited by serine protease inhibitor AEBSF when present during an early stage of infection
a599eb2c6ca51522fa234d8059f989569f4fe298.json,Emerging Roles of Viroporins Encoded by DNA Viruses: Novel Targets for Antivirals?
19e9c8796df362aa81ecfabf7730cfa4df5e5be6.json,Establishment of Myotis myotis Cell Lines -Model for Investigation of Host-Pathogen Interaction in a Natural Host for Emerging Viruses
c7b980605c4ba138f35378e5f56b95e677cc87c5.json,Ubiquitin-specific Protease 15 Negatively Regulates Virus- induced Type I Interferon Signaling via Catalytically-dependent and -independent Mechanisms OPEN
36de1c611ceee1af5ceddea2e4041691829cf7ef.json,The Hepatitis C Virus-Induced Membranous Web in Liver Tissue
ebf258ca8bfc0adbd09d0ebe0c5f25688fbc7c34.json,Glucose-6-Phosphate Dehydrogenase (G6PD)-Deficient Epithelial Cells Are Less Tolerant to Infection by Staphylococcus aureus
aa264b65408831a37b2943b60805e3773e0acaa5.json,Comparison of broad-spectrum antiviral activities of the synthetic rocaglate CR-31-B (−) and the eIF4A-inhibitor Silvestrol
f6b79474869aa89ef3a3cab01f39abac279c5132.json,Proteomic Profiling of the TRAF3 Interactome Network Reveals a New Role for the ER-to-Golgi Transport Compartments in Innate Immunity
81790ee8c55a6893a0f1a69214943c7b653c91c6.json,Newcastle disease virus induces G 0 /G 1 cell cycle arrest in asynchronously growing cells
62780f84b91034472b9ed1d727834c7560764099.json,Diverse Viruses Require the Calcium Transporter SPCA1 for Maturation and Spread Article Diverse Viruses Require the Calcium Transporter SPCA1 for Maturation and Spread
14898820328acb4f3dcf85f33f3addb113d5a97d.json,Modulation of Autophagy-Like Processes by Tumor Viruses
c784e33cfb740754fa5691b87ba5a53697597f10.json,UC Irvine UC Irvine Previously Published Works Title Poliovirus infection induces the co-localization of cellular protein SRp20 with TIA-1
130c4c6c7faab2f0c0143b6f0cd0118b27c91dea.json,Complement Evasion Strategies of Viruses: An Overview
53442eacc3f233078507fa37b78267399e8c1e3b.json,Dysregulation of Long Non-coding RNA (lncRNA) Genes and Predicted lncRNA-protein Interactions during Zika Virus Infection
63a98dbb196b0ceacae4a16715ca8540b857cd22.json,Quercetin as an Antiviral Agent Inhibits Influenza A Virus (IAV) Entry
e0e8ee783d4c465b22a44cb27e7e0f1b0d073245.json,Significant Interference with Porcine Epidemic Diarrhea Virus Pandemic and Classical Strain Replication in Small-Intestine Epithelial Cells Using an shRNA Expression Vector
fd84dc607d49e49f0d2887344d3eab3f2b95e187.json,Cellular Signaling Analysis shows antiviral
c051ae3e13770b683df8beca5ae92f808aa9f907.json,IFN-lambda preferably inhibits PEDV infection of porcine intestinal epithelial cells compared with IFN-alpha
cfa02214264de0228b64d968740c91ce88023511.json,Human coronavirus NL63 replication is cyclophilin A-dependent and inhibited by non-immunosuppressive cyclosporine A-derivatives including Alisporivir
ea157aed5d0e78fadb5d6ecd698c14035c54e29e.json,Multifaceted roles for lipids in viral infection
0cd1453fb9f28809b7544dcdcb0d6b3b4e42b3cc.json,Viral Regulation of RNA Granules in Infected Cells
a9af3598d5bb039283b8334f770488e6e8e6821c.json,Changes in mRNA abundance drive shuttling of RNA binding proteins
201e6b41ce9154b6740c2ea4bbb5c7d9702a1987.json,The OC43 human coronavirus envelope protein is critical for infectious virus production and propagation in neuronal cells and is a determinant of neurovirulence and CNS pathology
e952843f8bdc91e48ca6fa5fa94d53abdfb63ff7.json,The Ubiquitin-Conjugating System: Multiple Roles in Viral Replication and Infection
6d9da85d0033bda39063c0827b52037eeb5f25d1.json,Autophagic machinery activated by dengue virus enhances virus replication
008d047db717ab57103f347beaba0388d17446a5.json,Porcine epidemic diarrhea virus N protein prolongs S-phase cell cycle
5f56a9b712608c599a21191b06b78bfa70ad523f.json,Long non-coding RNA MEG3 attends to morphine-mediated autophagy of HT22 cells through modulating ERK pathway
8de34443c38db9422b06a2f583416660f1dca670.json,Cathepsin W Is Required for Escape of Influenza A Virus from Late Endosomes
e1684d4ad73d5982451ae73e97542c2559c04038.json,Chlamydia trachomatis-infected cells and uninfected-bystander cells exhibit diametrically opposed responses to interferon gamma OPEN
311a15d92b87b2bc41f00afed881b95e93c22fcc.json,Comparative analysis reveals adaptive evolution of bat IFITMs and a novel 1 antiviral determinant
68ca53b6414e682661c4decd41eb9ff00574d862.json,Targeting of the Nasal Mucosa by Japanese Encephalitis Virus for Non-Vector-Borne Transmission
072b14ae999cacac8ce8e35bf4b42999dcc6a48a.json,Retardation of cell growth by avian reovirus p17 through the activation of p53 pathway
19df6a2ae9a9070dd15404465eed98ad222b27f0.json,GILT restricts the cellular entry mediated by the envelope glycoproteins of SARS-CoV
0b48e310b1f5d0205ad5ffa292d950d2808185c0.json,Microarray analysis identifies the Potential role of long non-coding rna in regulating neuroinflammation during Japanese encephalitis Virus infection
e8913cb59861302b5e0abb9eb28b1fdcdc2b71b7.json,LETTER Simultaneous and systematic analysis of cellular and viral gene expression during Enterovirus 71-induced host shutoff
bf63f2e34138691d31b1282fe9cf47423c5f5a8a.json,The antiparasitic drug niclosamide inhibits dengue virus infection by interfering with endosomal acidification independent of mTOR
586316e4ba8fae180a835b3898cbcb2b9d7c7c60.json,Interferon-stimulated genes and their antiviral effector functions
73160414a91cb35ebfbcea9203bc28d03bc76a3b.json,Flunarizine Prevents Hepatitis C Virus Membrane Fusion in a Genotype-dependent Manner by Targeting the Potential Fusion Peptide within E1 HHS Public Access
077fdedebe982644bd8eb2ad732ec9c1b2cff475.json,N-Terminal Acetylation by NatB Is Required for the Shutoff Activity of Influenza A Virus PA-X
00baf167b536dde6a06bfe431aec3e514e04a42b.json,Applications of high-throughput genomics to antiviral research: evasion of antiviral responses and activation of inflammation during fulminant RNA virus infection
6e67417fbe15bbfa1dc530ceb8a41c796074aa9b.json,Ambra1 spatially regulates Src activity and Src/FAK-mediated cancer cell invasion via trafficking networks
19daf2ddb12b04fd7091cab38d3f45645cebce07.json,Proteomic alteration of Marc-145 cells and PAMs after infection by porcine reproductive and respiratory syndrome virus
998b88e3c1b906f669c7ffb0688862abb542cd01.json,Two-amino acids change in the nsp4 of SARS coronavirus abolishes viral replication
24ed22a878649ce74463bf63090563093d002c86.json,Exposure to Ozone Modulates Human Airway Protease/ Antiprotease Balance Contributing to Increased Influenza A Infection
65bb23e5e0c90ac6d7c365f0d0f79e35b91c803f.json,Intracellular pathogen detection by RIG-I-like receptors
8b7d76ba81c3eb5ddf6e9330e16ce1189fe1f08b.json,Mesenchymal stem cell-derived extracellular vesicles attenuate influenza virus-induced acute lung injury in a pig model
14ed095effb9d16007128bba66fe0be1c65663c3.json,Antiviral RNAi: Translating Science Towards Therapeutic Success
65b70959997868667b6ad45316855fe6d9e3154e.json,Cathepsins B and L activate Ebola but not Marburg virus glycoproteins for efficient entry into cell lines and macrophages independent of TMPRSS2 expression
2b2acb39556c4efda3e4729c3718f2034579428b.json,Attenuation of SARS coronavirus by a short hairpin RNA expression plasmid targeting RNA-dependent RNA polymerase
541e4b9cc19cdef991c78ff39e6ad79c1f5ecb09.json,Virology Journal The role of NH 4 Cl and cysteine proteases in Human Papillomavirus type 16 infection Sarah A Dabydeen* †1 and Patricio I Meneses †1
2522231ac6a1faeccfaf8f71e1bdc7cc81c7c647.json,Characterization of Influenza A Virus Infection in Mouse Pulmonary Stem/Progenitor Cells
f33491026ec8a7ac58322108f149d5dc9d8dca89.json,Article 1139 1 Original research
ff6d9926b159c7997f3b71878a220e89e06fb7e2.json,Methyltransferase of a cell culture-adapted hepatitis E inhibits the MDA5 receptor signaling pathway
d4dc9bbff86e094b62f37b280b1b5c594a9c1c5b.json,Cholesterol Dependence of Pseudorabies Herpesvirus Entry
16283e25f01d47898ad2b82d56bd81d5ccf44a5d.json,Suppression of feline coronavirus replication in vitro by cyclosporin A
656ef218f7dcea5555a59cdc29d0f9ec8d5c2a82.json,MERS-CoV NSP16 necessary for IFN resistance and viral pathogenesis
e88b28b3664d30889a0161ddee188c48897a3bee.json,SARS-CoV 9b Protein Diffuses into Nucleus
dd0159ba60fc4458dc4a2c632fe9072d8cc7ff36.json,Host miR-26a suppresses replication of porcine reproductive and respiratory syndrome virus by upregulating type I interferons
9b7bce91950139e59234302c89d3d98ad13ca6da.json,Roles for the Recycling Endosome
7cdd50888f639629380fa9906d73f97010158127.json,2 3 TIM-1 SERVES AS A NONREDUNDANT RECEPTOR FOR EBOLA 4 VIRUS
b1ac4363950bdd885496d03b7b035ca8bb7e2b3b.json,OAS-RNase L innate immune pathway mediates the cytotoxicity of a DNA-demethylating drug
b754344c625a0cb9867bfa073d1df0dec71997c1.json,Methods for studying antiviral functions of macrophages and mononuclear phagocytes
8e0ad88c998cfd9bca4fd637c9757c65bbc5becd.json,GRP78: A cell's response to stress
c6d8bc1c51f8962ffbeb497c413e3e5e225b9c3e.json,Picornavirus Subversion of the Autophagy Pathway
a857ddce8f702e40d71bd2e6e8d04611b4850bed.json,The molecular tweezer CLR01 inhibits Ebola and Zika virus infection
ee46c9064c2ef4916ba7d54c80236d3cb1781635.json,Deubiquitylating Enzymes and DNA Damage Response Pathways
630a94063d188ceeb2302472ac2e1a0da2e31216.json,Consecutive Inhibition of ISG15 Expression and ISGylation by Cytomegalovirus Regulators
c16d19032f42486b997727ee0f732ab9fd5b9a84.json,Rhesus macaque IFITM3 gene polymorphisms and SIV infection
35986d93702911ced2b8f81686d04909ac40c5b5.json,Virus-Induced Diabetes Mellitus. X. Attachment of Encephalomyocarditis Virus and Permissiveness of Cultured Pancreatic p Cells to Infection
