file,title
86a998617c077f4fe2ab26214995a3548fbc0fc5.json,Middle East Respiratory Syndrome and Severe Acute Respiratory Syndrome
464f7d3a460eb51dbc25bd12639b22079a73f85a.json,Viral lncRNA: A regulatory molecule for controlling virus life cycle
38aa050ad79d8a1d7022c33535255ce9d47914e5.json,Potent Inhibition of Junín Virus Infection by Interferon in Murine Cells
61722c462b054f36461375e96e502cbf22648c04.json,2 convergent Research center for emerging Virus infection
b46317ea8250eebf58f3f5dd1849e1b64148dffd.json,Article PI4KB on Inclusion Bodies Formed by ER Membrane Remodeling Facilitates Replication of Human Parainfluenza Virus Type 3
207885268ef61365fc89820ecb7c854a3dc23d9a.json,A novel mechanism of RNase L inhibition: Theiler's virus L Ã protein prevents 2-5A from binding to RNase L
fef0bb9eaac69559d0ff2f92ff83e0affd4435f0.json,Pathogenic Influenza Viruses and Coronaviruses Utilize Similar and Contrasting Approaches To Control Interferon-Stimulated Gene Responses
d65e23d9cd5d984bd31df5c4363d376dbcc527d9.json,Augmentation of chemokine production by severe acute respiratory syndrome coronavirus 3a/X1 and 7a/X4 proteins through NF-jB activation
0cb9c296684ca5e71462d825cab2827854a01544.json,p53 is not necessary for DUX4 pathology
dacc557b6e40bb69974e2e1a831aef665e524867.json,Cleavage of a Neuroinvasive Human Respiratory Virus Spike Glycoprotein by Proprotein Convertases Modulates Neurovirulence and Virus Spread within the Central Nervous System
6095a04fde33482975d02a46069943568b11ebe7.json,PI3K/Akt/p53 pathway inhibits reovirus infection
4bf587d8051a33e9e8215ef96afa025a943dc1b8.json,The interplay between infectious pancreatic necrosis virus (IPNV) and the IFN system: IFN signaling is inhibited by IPNV infection
b346900932930ece4127e7bb8f3990c8e0c1fbec.json,Swine interferon-induced transmembrane protein
70da3ee5739197acb1879c1d23606681aaac2e1c.json,A balanced game: chicken macrophage response to ALV-J infection
fb773634dcd17957e12be78e5c33ba753d82d3f5.json,Role of Glutathionylation in Infection and Inflammation
8020df26368f55f129b7a20a652763b3b714ca39.json,Viral journeys on the intracellular highways
ff218f343fbca258501ba42368ecbb57660e5a8f.json,An Analogue of the Antibiotic Teicoplanin Prevents Flavivirus Entry In Vitro
a6754979ae7d3ebf187418f107750fd007d9bf93.json,CLEC4M-positive and CD81-negative Huh7 cells are not susceptible to JFH-1 HCVcc infection but mediate transinfection
df783d511b145a10e7f609a87392eb50799d2b2b.json,NOA36 Protein Contains a Highly Conserved Nucleolar Localization Signal Capable of Directing Functional Proteins to the Nucleolus
daf5c921872ab27dc1a714408f626f49c71480e1.json,Strain-Specific Antagonism of the Human H1N1 Influenza A Virus against Equine Tetherin
625afb5a588fd265e15b652a437ef9f521682aee.json,Montelukast
c66db4790344510781ca7d7cba52739ba7f93a24.json,IFITM1 is a tight junction protein that inhibits hepatitis C virus entry NIH Public Access
bb9fa420cb74aed846df2a44a6cbd0991d2b2e59.json,A single-amino acid substitution in West Nile virus 2K peptide between NS4A and NS4B confers resistance to lycorine
bfa1dab8c91f41f59df39489115a8b2e19e537bf.json,Transcriptomic Characterization of the Novel Avian-Origin Influenza A (H7N9) Virus: Specific Host Response and Responses Intermediate between Avian (H5N1 and H7N7) and Human (H3N2) Viruses and Implications for Treatment Options
404bf0836c388f561f796369c26d0bbf6f37b407.json,Small Interfering RNA Targeting M2 Gene Induces Effective and Long Term Inhibition of Influenza A Virus Replication
78b7a343a9ffffc005daf8a962cf9140f5dc8735.json,Distributed under Creative Commons CC-BY 4.0 miR-27b attenuates apoptosis induced by transmissible gastroenteritis virus (TGEV) infection via targeting runt- related transcription factor 1 (RUNX1)
756448c2d7dda1e89c0ea4acf6ccd5e2ee02517e.json,viruses The Interplay of Viral and Host Factors in Chikungunya Virus Infection: Targets for Antiviral Strategies
92fa1b14f2644d87fb2117e50b6372a5d3c5fb59.json,Modulation of host cell responses and evasion strategies for porcine reproductive and respiratory syndrome virus
0cf5cd1d540a88eb0efe3ba8815805508c8bfc0f.json,Cyclophilins and cyclophilin inhibitors in nidovirus replication
0d82c429737f250a7bcd230fea2e4725edc2439a.json,viruses The Interaction between Nidovirales and Autophagy Components
e9b89cfe2cd2f085f3d85cf0c616a094aac33e90.json,Cellular RNA Helicases Support Early and Late Events in Retroviral Replication Chapter Outline RNA Helicase and Retroviruses in the Advent of "Omics Technology" 258 Early Events: Reverse Transcription and Integration 259 DHX9/RNA Helicase A Activity in the Genomic RNP 259 MOV10 Activity in Virions Remains Undefined 262 Late Events: Provirus Transcription
50005544cba05adf4b743e0ec11f39bd8d903cbd.json,Alternative autophagy
05ce1f7ae3a2051067e57e5e52f9cdad0e26a187.json,The ORF2 glycoprotein of hepatitis E virus inhibits cellular NF-κB activity by blocking ubiquitination mediated proteasomal degradation of IκBα in human hepatoma cells
c39ece828769a97d7ab743e5bae232bc127ae6a3.json,The Influenza A Virus Endoribonuclease PA-X Usurps Host mRNA Processing Machinery to Limit Host Gene Expression
3c72ead2a9cc9c0deee89ac36d97add000613d30.json,Silencing viruses by RNA interference
962fe9022b7ecbb15c50380673d47716888060d4.json,The natural compound silvestrol inhibits hepatitis E virus (HEV) replication in vitro and in vivo
71b1e5b3dcbccd130699fbbdbc537a66a24598bc.json,Engineering a Replication-Competent
3e4a0ae20a7459833bb62fb79d7c28b46d32a30b.json,Arthropod-Borne Flaviviruses and RNA Interference: Seeking New Approaches for Antiviral Therapy
d3b010c26c6791989ae6d351252a52ecfc8d4590.json,Small interference RNA-mediated knockdown of sperm associated antigen 9 having structural homology with c-Jun N-terminal kinase-interacting protein
fdd56928f8a84ccebe6435520b1a195fb641a9c5.json,SIRT1 Suppresses Human T-Cell Leukemia Virus Type 1 Transcription
d800e113c0f37fea4586a18115d07a7bbb3e5464.json,The ATF6 branch of unfolded protein response and apoptosis are activated to promote African swine fever virus infection
7dd9dcdfc9cf0fed538df9e01f16297f1666e03e.json,Virus growth and antibody responses following respiratory tract infection of ferrets and mice with WT and P/V mutants of the paramyxovirus Simian Virus 5
dd54e45c61677a09e56a61b0216866c972705d54.json,Functional motifs responsible for human metapneumovirus M2-2-mediated innate immune evasion
c5895a4441829fd3e22ba0ad09fb09956b5fe0f5.json,High-throughput assay using a GFP-expressing replicon for SARS-CoV drug discovery
330a49685a269070206fdd0f4bba345e96bf492f.json,Recent strategies and progress in identifying host factors involved in virus replication
7e51d91074212ae3b7facd94bdb48c6f21bc0655.json,Activation of c-Jun N-terminal kinase by Akabane virus is required for apoptosis
a31454d7f59d2bac4248b66792db9c0c18a3cba1.json,Intracellular processing of immunostimulatory CpG-siRNA: Toll- like receptor 9 facilitates siRNA dicing and endosomal escape NIH Public Access
cf6c6fa2a4cf3fd624d4ef8291804a3fab3f1b2a.json,The SARS Coronavirus 3a Protein Causes Endoplasmic Reticulum Stress and Induces Ligand-Independent Downregulation of the Type 1 Interferon Receptor
554d4209692f1b384ec738f3c74b110ccf5e8dbb.json,Phosphoproteomic-based kinase profiling early in influenza virus infection identifies GRK2 as antiviral drug target
9aed1e2e3dc529e3863b89a60bb4e377e8c3a3e6.json,Viral Membrane Channels: Role and Function in the Virus Life Cycle
cd3c7bc4656919fc9d8564bff6693b24631f97d7.json,Interferon-Induced Protein 44 Interacts with Cellular FK506- Binding Protein 5
c5a1c8812eed6acb2b0bab18273f730512445097.json,Commentary Aminoacyl-tRNA synthetases
9faf6a32a170b3fc5950af6a7d34cf710c79321d.json,Gene silencing of β-galactosamide α-2
d5bcb5d8c2edd7162e5f0fe6c189662b39eebfbe.json,The Role of EGFR in Influenza Pathogenicity: Multiple Network-Based Approaches to Identify a Key Regulator of Non-lethal Infections
ab1ac4f7b9c57dad5e3d61f72e8e3d552059fa09.json,Virology Journal Synergistic inhibition of human cytomegalovirus replication by interferon-alpha/beta and interferon-gamma
378f36b7428854418512d85a7426c7bfd5832f91.json,Simian varicella virus causes robust transcriptional changes in T cells that support viral replication
7b620ef79c42118f157be2d9ab586fbd615b9fc6.json,Hyper-activated IRF-1 and STAT1 contribute to enhanced Interferon stimulated gene (ISG) expression by Interferon α and γ co-treatment in human hepatoma cells
6799e37b5fda2d18292b86b6a6c7ba1eb185d018.json,Late Endosomal/Lysosomal Cholesterol Accumulation Is a Host Cell-Protective Mechanism Inhibiting Endosomal Escape of Influenza A Virus
a2e8d9291e399c6d8adc6d39318de197e86b3f4e.json,Antiviral Activity of Glycyrrhizin against Hepatitis C Virus In Vitro
cefcc643edc7af8c8b1cce617244536def510a96.json,Regulation of Autophagy by Extracellular Signal- Regulated Protein Kinases During 1-Methyl-4- Phenylpyridinium-Induced Cell Death
5fc3eedb09f3b7624fec7d2b9afedfffbab47a21.json,viruses Regulation of Stress Responses and Translational Control by Coronavirus
d2a0d7e1b8038372dfd115abe36f5cfba26fd062.json,The protein interaction networks of mucolipins and two-pore channels
eb7ed9704b8aca731653e08d7a790c84f4352f37.json,Review Pathogen-Mediated Posttranslational Modifications: A Re-emerging Field
5f6a0e160d0a1e1204419cc8047a2206a571b8cb.json,Interplay between the virus and the ubiquitin- proteasome system: molecular mechanism of viral pathogenesis
daa7e124a09a2e115e1280e4c31891db5a22b05d.json,Amphotericin B Increases Influenza A Virus Infection by Preventing IFITM3-Mediated Restriction
fe6e370ce107e93d974b8b4c33025652cccf813e.json,Molecular characterisation of RIG-I-like helicases in the black flying fox
eaccbbd4d93f295b6c22ae217f159c288b29deb6.json,Understanding PRRSV Infection in Porcine Lung Based on Genome-Wide Transcriptome Response Identified by Deep Sequencing
b32e3e2b7c3598deea425036dc4d39bc5910e799.json,Expressional induction of Paralichthys olivaceus cathepsin B gene in response to virus
dfd5bb84bc6b88bf01e7bd2a6bf5f8a4ad8e2033.json,Ribavirin inhibits Zika virus (ZIKV) replication in vitro and suppresses viremia in ZIKV-infected STAT1-deficient mice
da4831bc0999db4090ab0a290709eddb0b2bf0d1.json,BST2/CD317 counteracts human coronavirus 229E productive infection by tethering virions at the cell surface
447c3369b2bb770f444e8623c47caedb05f9549b.json,MicroRNA Regulation of RNA Virus Replication and Pathogenesis
de33e8c855455881ed7fa687b513269c275e5873.json,Porcine epidemic diarrhea virus induces caspase-independent apoptosis through activation of mitochondrial apoptosis-inducing factor
d71c2fa8fe1c3df75d031c50267993ede529b85c.json,The SARS coronavirus papain like protease can inhibit IRF3 at a post activation step that requires deubiquitination activity
95742e15e5dc39ed30e4b72398dd4a49507dcec1.json,Mini review Message in a bottle: lessons learned from antagonism of STING signalling during RNA virus infection
1c06378f629bfa8870c89b3abfdecfc19db9b459.json,The Viral Protein Corona Directs Viral Pathogenesis and Amyloid Aggregation
b29aec7c51b6c428e566fa6e092797fc4da21b29.json,The Battle between Virus and Host: Modulation of Toll-Like Receptor Signaling Pathways by Virus Infection
8e08171efdeefb1359c606284d75271667ef8252.json,CRIspR-mediated activation of endogenous BST-2/tetherin expression inhibits wild-type HIV-1 production OPEN
7045ec55df870b7d611154081ae7e469883f64c4.json,Aurintricarboxylic Acid Is a Potent Inhibitor of Influenza A and B Virus Neuraminidases
ec8b7a64cd182081f2f408cce8775e03fe7b3863.json,The Anti-Helminthic Niclosamide Inhibits Wnt/Frizzled1 Signaling †
6af49373c566eac05d2609e3474e847157cafb3b.json,Open Access RESEARCH Proteomic analysis of primary duck hepatocytes infected with duck hepatitis B virus
3f06c41154ff140670ba10f54eeaf640c39f29b9.json,Network Clustering Revealed the Systemic Alterations of Mitochondrial Protein Expression
cdfc8be07677f50c91106e5b56379acb0d0eb289.json,Stress-induced phospho-ubiquitin formation causes parkin degradation
62a1f28a0ad0c2c37252351ad64fd7d8b0efdcc4.json,a section of the journal Frontiers in Microbiology Comparative Analysis of Salivary Gland Proteomes of Two Glossina Species that Exhibit Differential Hytrosavirus Pathologies
0221ec8f08579d957ed164d949b535e3a52da40d.json,Avian influenza rapidly induces antiviral genes in duck lung and intestine
30cde71f98e1b4202ba43473e686ec4b5b23d42f.json,A Single-Cell Platform for Monitoring Viral Proteolytic Cleavage in Different Cellular Compartments Supplementary Issue: Biochemistry of the Individual Living Cell
dc69e220d40597887fac3851a1601408fe7bf568.json,viruses Molecular Insights into Crimean-Congo Hemorrhagic Fever Virus
4fcb5335f26d89d64cf5aa7487acbc813d02aa48.json,Peptide-conjugated morpholino oligomers inhibit porcine reproductive and respiratory syndrome virus replication
4a698e56af8042a4c35a26127c4da5fc5ff7fa95.json,Long non-coding RNA BST2/BISPR is induced by IFN and regulates the expression of the antiviral factor tetherin
76b96ffbbdea59714eba9d891362ceb32731ad90.json,Distributed under Creative Commons CC-BY 4.0 OPEN ACCESS Tandem mass tag-based quantitative proteomic analysis of lycorine treatment in highly pathogenic avian influenza H5N1 virus infection
b0c4f1bdd3fe67c3d7501a7b2fbfc78f53c0d34f.json,Emerging Themes in PDZ Domain Signaling: Structure
488e866a3ed2d3764a91dad6a668a304859ce1ad.json,Viral lncRNA: A regulatory molecule for controlling virus life cycle
703b0f937e3db3975e15b0f0afc230955e35ddac.json,Differential response of porcine immature monocyte-derived dendritic cells to virulent and inactivated transmissible gastroenteritis virus
8b67993220966ebef79688b594d852e4da9bbadb.json,Induction of Antiviral Immune Response through Recognition of the Repeating Subunit Pattern of Viral Capsids Is Toll- Like Receptor 2 Dependent
8d0569b9fe93d0997ca38060117ffc6381122957.json,Application of RNA interference for inhibiting the replication of feline immunodeficiency virus in chronically infected cell lines
78057e9db3bebe6ecfc99fbc036414ebd4115cfd.json,Diminished COX-2/PGE 2 -Mediated Antiviral Response Due to Impaired NOX/MAPK Signaling in G6PD-Knockdown Lung Epithelial Cells
9a0bbb306cddc7201b312cba0ab8181e971e7b6e.json,In vitro inhibition of feline coronavirus replication by small interfering RNAs
75882d6856d4243248aa32fe119153efeb0dbe12.json,Lipopolysaccharide and Tumor Necrosis Factor Alpha Inhibit Interferon Signaling in Hepatocytes by Increasing Ubiquitin-Like Protease 18 (USP18) Expression
6439aa846c66ee03030be2e2f742304fae6810be.json,Group 2 coronaviruses prevent immediate early interferon induction by protection of viral RNA from host cell recognition
8c1c3b1f8dedc265986178cbd90213cd0f6b73cb.json,Activation of protein kinase R is required for induction of stress granules by respiratory syncytial virus but dispensable for viral replication
01313cfb80a0a3532ae597e05482797329f9beb4.json,Co-expression vs. co-infection using baculovirus expression vectors in insect cell culture: Benefits and drawbacks
6285c867e075bba0b64f163f2bcafd5fd34bd910.json,The coronavirus nucleocapsid protein is ADP-ribosylated
48a8ad8d5c1a4ec2d3fe762a928a3c2e67af8c2b.json,Viral proteins function as ion channels
8421dfdeccb793a0f326dede0a11e437450b6b59.json,ANALYTICAL BIOCHEMISTRY
618a793838421a7bf238e8f6ae2635ca3d2f5a25.json,Regulation of Nucleotide Metabolism and Germline Proliferation in Response to Nucleotide Imbalance and Genotoxic Stresses by EndoU Nuclease HHS Public Access
922c1567a2586e3a7c8c955622465e91f5a9456d.json,Kinetics and synergistic effects of siRNAs targeting structural and replicase genes of SARS-associated coronavirus
6364a6acea5c75ec6f2e82ae0a032abe593f4e0f.json,Molecular Virology of Hepatitis E Virus
335e894a725e26adfe71b89170e3fc1301eafb1c.json,Dissection of the Influenza A Virus Endocytic Routes Reveals Macropinocytosis as an Alternative Entry Pathway
72a5995cb9dc08122a069c6b02e72f2894e0b07c.json,Decitabine-Induced Changes in Human Myelodysplastic Syndrome Cell Line SKM-1 Are Mediated by FOXO3A Activation
08d0057eaad519e3d6ef88ffbbc2187b2c11f126.json,Genetic and biological characterisation of Zika virus isolates from different Brazilian regions
f5e974ef3a8c983ae63ac4f4aa2b6ec0e3678032.json,Recent Progress in Studies of Arterivirus-and Coronavirus-Host Interactions
634b79269e0f00d35bcea1a2dc7643884b8c6b3a.json,Surface vimentin is critical for the cell entry of SARS-CoV
de70eeaf1ee8cc318f88f942c92eb82f4e8c9ed3.json,Interleukin-1 receptor-associated kinase M (IRAK-M) promotes human rhinovirus infection in lung epithelial cells via the autophagic pathway NIH Public Access Author Manuscript
c7c6c6ff7580f79ffba12017575ac3ccca4bc9b7.json,Endoplasmic reticulum: a focal point of Zika virus infection
4d77078dcc719ace0848a3584d9e287fa5b8618c.json,Autophagy
61baa9b1ae842b28e3e7aa90a3e8034d96ba9aa9.json,The Nsp12-coding region of type 2 PRRSV is required for viral subgenomic mRNA synthesis
c6b416e31cb51e4ecc6264f20bb37db28e9a4cef.json,Human IFIT1 Inhibits mRNA Translation of Rubulaviruses but Not Other Members of the Paramyxoviridae Family
bdd2f6cee151c4613727760f8e62f964472abf10.json,Protein & Cell Protein & Cell REVIEW The essential adaptors of innate immune signaling
dd2054667f5f1db92d4649fc420d0d86dc39dcd9.json,CDC42 Use in Viral Cell Entry Processes by RNA Viruses
e5adf7aca5308543613d1f966616c2fbec18ec21.json,Cholesterol-rich lipid rafts play an important role in the Cyprinid herpesvirus 3 replication cycle $
6b20f25b48785e488fb280a76ec8f1da3bf8e2a0.json,Resveratrol Inhibits KSHV Reactivation by Lowering the Levels of Cellular EGR-1
069d6ce905dc7992f5bc8692218ca3969ab3e227.json,Antiviral Protection by IFITM3 In Vivo HHS Public Access
cb763a61411514366d16bb2571461b6df1361517.json,Tropism and Induction of Cytokines in Human Embryonic-Stem Cells-Derived Neural Progenitors upon Inoculation with Highly- Pathogenic Avian H5N1 Influenza Virus
62298f90df017016d34e978befc29acbec201ccd.json,The alkyl side chain of PACA nanoparticles dictates the impact on cellular stress responses and the mode of particle-induced cell death
3a35b1a403a2b8e186f8aacbd6f30eb70e81cd98.json,SYNCRIP (synaptotagmin-binding
3d4b0d8d4ac0c8419efb82278b823952e94d1393.json,viruses Host and Viral Proteins Modulating Ebola and Marburg Virus Egress
0241ada1b12eaacadc56a59586bc1728a580583d.json,Permissiveness of human hepatoma cell lines for HCV infection
9eec2605140f0856096789a10421729e4ba9d4e5.json,Houttuynia cordata blocks HSV infection through inhibition of NF-jB activation
5552890914af321d5876d2da1da527e9892ea09e.json,Quantitative Proteomics Identifies Serum Response Factor Binding Protein 1 as a Host Factor for Hepatitis C Virus Entry
b454887997af026ed0589fcb18e59aed44473e1d.json,Super Resolution Microscopy Reveals that Caveolin-1 Is Required for Spatial Organization of CRFB1 and Subsequent Antiviral Signaling in Zebrafish
a6b2ed77eb280c2906cbe64039b9e3dbcd0c2b04.json,Ross River virus envelope glycans contribute to disease through activation of the host complement system
4a1473dff62b4a5607cc52a3724756438f0c8af3.json,Transcriptome sequencing and development of an expression microarray platform for liver infection in adenovirus type 5-infected Syrian golden hamsters
1e23bde4e435cbcb5f23f6b1dc2f6687f1c3b221.json,Severe acute respiratory syndrome coronavirus protein 7a interacts with hSGT q
5c364a85b8e920e9b4ad2fa201589fc319bc174b.json,Interplay between SIN3A and STAT3 Mediates Chromatin Conformational Changes and GFAP Expression during Cellular Differentiation
d07a12c15f26f94f6b1d0fc1ab61730140e8c7d2.json,A small stem-loop structure of the Ebola virus trailer is essential for replication and interacts with heat-shock protein A8
92860a0f4425d12aafb8e096d8e65d38eb67dff5.json,Mutation of Ebola virus VP35 Ser129 uncouples interferon antagonist and replication functions
5c4dfdf8ee6230324845b917be55c47d1e991f2c.json,hCLE/C14orf166 Associates with DDX1-HSPC117-FAM98B in a Novel Transcription-Dependent Shuttling RNA- Transporting Complex
06c16fa82eea996e285bd1611bc929d57dfb0a8f.json,Porcine epidemic diarrhea virus through p53-dependent pathway causes cell cycle arrest in the G0/G1 phase
a43db4dbbe6272ff71bcd5dc9cbf29bad9cd958e.json,Inhibition of Tetraspanin Functions Impairs Human Papillomavirus and Cytomegalovirus Infections
f48a26496eec9f955c65e9d89305c4bc5df2718a.json,IRF7 in the Australian Black Flying Fox
52bf83ff771d92f697a4ab0cfe70a99503940050.json,Central Role of Ubiquitination in Genome Maintenance: DNA Replication and Damage Repair
1dad74f9f8d058791ce59a54c2c4171c161821e0.json,Lipidation increases antiviral activities of coronavirus fusion-inhibiting peptides
7395de48b2402e5e1561a93b99e8aae8728c6ff1.json,RNA-binding activity of TRIM25 is mediated by its PRY/SPRY domain and is required for ubiquitination E-mail: Gracjan.Michlewski@ed.ac.uk Running Title: RNA-binding protein TRIM25 KEYWORDS: Novel RNA-binding proteins
c79cfa0bb8017217a2626f1b4aafdfdab162a8ce.json,Quantitative Proteomics Reveal Peroxiredoxin Perturbation Upon Persistent Lymphocytic Choriomeningitis Virus Infection in Human Cells
2fd0fccb43ad3cb1634370734ba27eaed2cf015a.json,Caveolin-1 Associated Adenovirus Entry into Human Corneal Cells
3339f4bb346bfa3070ae5fc7dc745ef051535b0e.json,Coronavirus Cell Entry Occurs through the Endo-/ Lysosomal Pathway in a Proteolysis-Dependent Manner
26800b3eaee2dc23b411ad506c255ab5133a8608.json,Regulating gene expression in animals through RNA endonucleolytic cleavage
65ca70396d041072aeab57a007cffef0870897cf.json,Common Nodes of Virus-Host Interaction Revealed Through an Integrated Network Analysis
0a41b85153ef8a084f7b3476d4d38832f533e914.json,Effective Treatment of Respiratory Alphaherpesvirus Infection Using RNA Interference
9afe908babd48784b72535b7d9b3d964d1cc6b14.json,6-Thioguanine inhibits rotavirus replication through suppression of Rac1 GDP/GTP cycling
21c5b88a655bb1b5b8c3c3cd1dc1aefcf2c75cbd.json,Porcine Reproductive and Respiratory Syndrome Virus strains with Higher Virulence Cause Marked Protein Profile Changes in MARC-145 Cells OPEN
5afa333a59a3d818c758dbc752463b90436a1c57.json,ISG56/IFIT1 is primarily responsible for interferon- induced changes to patterns of parainfluenza virus type 5 transcription and protein synthesis
e90318a70577f501de82ffb11839cfe7f2aa5bb2.json,Regulation and evasion of antiviral immune responses by porcine reproductive and respiratory syndrome virus
89444dffc7f46f0f52709e43550ddb363a720340.json,Analysis of chikungunya virus proteins reveals that non-structural proteins nsP2 and nsP3 exhibit RNA interference (RNAi) suppressor activity OPEN
5af166022c0575cefcd0f2107b4fd1a657b6391b.json,Going to Bat(s) for Studies of Disease Tolerance
789ab4d7c1e859c96e68389e03290355c30a03a7.json,Identification of cellular proteome using two-dimensional difference gel electrophoresis in ST cells infected with transmissible gastroenteritis coronavirus
b0a6ed483bc608a977382c0781fdf31c73d28771.json,Proteolytic activation of the SARS-coronavirus spike protein: Cutting enzymes at the cutting edge of antiviral research
becb49a06c77576a802707d52d8ef8361425c84e.json,In vitro inhibition of CSFV replication by retroviral vector-mediated RNA interference
2c718308a4d41debe131fca643821cdca5ee8892.json,Ribavirin: a drug active against many viruses with multiple effects on virus replication and propagation. Molecular basis of ribavirin resistance ScienceDirect
a4cfc3e2cc8c3a69d8a6384aa77b9a9ff7a51dd7.json,Role of Pentraxin 3 in Shaping Arthritogenic Alphaviral Disease: From Enhanced Viral Replication to Immunomodulation
5f5b18b0f7c14a78216c49da9a13712161fe5750.json,The role of viral nucleic acid recognition in dendritic cells for innate and adaptive antiviral immunity
282fa1f4511c11ec637921f396ec2b2d1aba625d.json,Therapeutic Targets for the Treatment of Hepatitis E Virus Infection HHS Public Access
8b25bae266584f12c3b5af9e5cf3e81c84808c36.json,Interferon-induced transmembrane protein 3 blocks fusion of sensitive but not resistant viruses by partitioning into virus-carrying endosomes
7c299b1c2f8c81470a9356c21280b07fb5835191.json,Type I interferon signaling limits reoviral tropism within the brain and prevents lethal systemic infection NIH Public Access
352657225f9b69e4693a466de17c2a4d55ccc1d3.json,Proteomic approaches to uncovering virus-host protein interactions during the progression of viral infection
e2904c6e462291682dc4d65ce47a91bdc8509747.json,Identification of miRNomes reveals ssc-miR-30d-R_1 as a potential therapeutic target for PRRS viral infection OPEN
c48bb15af3fe47ce755d022245d64cc0df2537e2.json,UBXN1 interacts with the S1 protein of transmissible gastroenteritis coronavirus and plays a role in viral replication
3bd127aee44910d7a7377a1a58a48d9b91ebc209.json,Middle East respiratory syndrome and severe acute respiratory syndrome
d633bd45d16816814f6df5f930ddf8d460ac4b2a.json,Website 101 World Health Organization statistics. Future Virol
c043a8747fce01139068ca23917644195bb26749.json,SARS-CoV-Encoded Small RNAs Contribute to Infection-Associated Lung Pathology
05082393ba4c7ec530190dd887d99c74fd72f6d6.json,Self-assembly of the RZZ complex into filaments drives kinetochore expansion in the absence of microtubule attachment
520a5aabfd10f62a6be61f73a811388ce4e3bf7b.json,Intriguing interplay between feline infectious peritonitis virus and its receptors during entry in primary feline monocytes
48680c8f096d42d9e6d09f711fab46ae08ab89a1.json,Cellular response to influenza virus infection: a potential role for autophagy in CXCL10 and interferon-alpha induction
9fae51ab2616267198036d17a84788ab9c586fed.json,SYNCRIP (Synaptotagmin-Binding
44cbdded77107e8c97330deef77b1b761a9bb229.json,Differential expression of lncRNAs during the HIV replication cycle: an underestimated layer in the HIV- host interplay OPEN
adb06fe97e41c66f90850382e8c35c408601655a.json,Promyelocytic Leukemia Zinc Finger Protein Regulates Interferon-Mediated Innate Immunity
