file,title
3393660eb3bc406078bc25b1ccbd101844444896.json,The Human Microbiome and Personalized Medicine
d48ae48fa33c489b576489afc16c00f5b1532178.json,Virome Capture Sequencing Enables Sensitive Viral Diagnosis and Comprehensive Virome Analysis
8923bae528dc7e9ed10fbb6e823707dd1018be9d.json,Reference gene selection for normalization of RT-qPCR gene expression data from Actinidia deliciosa leaves infected with Pseudomonas syringae pv. actinidiae OPEN
bc55d27dc2474c1a34ac53de1d2b218cacc02c46.json,Loeffler 4.0: Diagnostic Metagenomics
29d374c381ed152a0a2550370fa8ff2234d8533b.json,Method of regulatory network that can explore protein regulations for disease classification
6b83ccbaff4b9d9f4ac38fcfbbb2bdde5b3c53aa.json,Genetic diversity
f7c0f747be302193f876a3d3ddf1e14098090e75.json,PhEVER: a database for the global exploration of virus-host evolutionary relationships
d75af019ef5ffd2aeba20f07de567d9c827a7142.json,ADVANCES IN REAL-TIME PCR: APPLICATION TO CLINICAL LABORATORY DIAGNOSTICS
b80d9de7750d627a0189fcd2dfd82c7efcb1c079.json,An interaction network of RNA-binding proteins involved in Drosophila oogenesis Running title: Interactome of RNA Binding Proteins from Drosophila ovaries
da692ee969d9c33986196372c3f7cb87fa6b6f8f.json,Database resources of the National Center for Biotechnology Information NCBI Resource Coordinators *
6d03f3e2dd6554f15526cb089337fa592fb1834c.json,Genome Organization of the SARS-CoV
3929d5fe37521db29b4d747ab3c9376f6865be16.json,A Versatile Sample Processing Workflow for Metagenomic Pathogen Detection OPEN
f8f49888663fdad58dabb5d7f9f8556b36d34587.json,HYPOTHESIS AND THEORY ARTICLE Estimating the diversity
f84faa4e1d19a1e208a0be0e093b72bab5ee9a42.json,Protein production and purification NIH Public Access NIH-PA Author Manuscript
0add910e9efb81f7b906101a7790b812074dc8b3.json,Human-Specific Evolution and Adaptation Led to Major Qualitative Differences in the Variable Receptors of Human and Chimpanzee Natural Killer Cells
707a1297b8ac950819a217102e5f4847a67b48c7.json,Marked Variability in the Extent of Protein Disorder within and between Viral Families
7694cd45d861b0363acf826f1ccb83b0f5a40e4c.json,MPLEx: a Robust and Universal Protocol for Single-Sample Integrative Proteomic
302334452b5bb75a083f56c74de9d333fd5a5b30.json,Pathogen Epidemiology
71f1a9afc05640752c9b1e7259211269352cf7f6.json,Similarity relations of DNA and RNA polymerases investigated by the principal component analysis of amino acid sequences
2c9e4dcabcbc5da864e42c53e2d8b835aa328bd1.json,Molecular methods for pathogen and microbial community detection and characterization: Current and potential application in diagnostic microbiology
405178382d43ce2210f9573baba85368387e44f9.json,Composition bias and genome polarity of RNA viruses
18d1ff1667652b4e383a0a1ea258db97ac74735c.json,CELLULAR & MOLECULAR BIOLOGY LETTERS Abbreviations used: 3D -three dimensional; BIND -Biomolecular Interaction Network Database; BLAST -Basic Local Alignment Search Tool; CAPRI -Critical Assessment of PRediction of Interactions; DBID -database of interacting domains; DIP -Database of Interacting Proteins; DNA -deoxyribonucleic acid; GO -Gene Ontology; HPRD -Human Protein Reference Database; KEGG -Kyoto Encyclopedia of Genes and Genomes; KO - KEGG Orthology; MetaBASIC -Bilaterally Amplified Sequence Information Comparison; MINT -Molecular Interaction Database; OPHID -Online Predicted Human Interaction Database; PDB -Protein Data Bank; RNA -ribonucleic acid Mini review THE INTERACTOME: PREDICTING THE PROTEIN-PROTEIN INTERACTIONS IN CELLS
f2e06c174008ed721d0a244309601c9923548901.json,Genomic analysis of codon usage shows influence of mutation pressure
69164d51aee4dfbca9f7bc6fb4bb27e4dd71cb56.json,JO2277 Pichinde munchique virulent derivative 1 ma
f9187e3a34dfe7e63989291c32b4f8254de5e6a0.json,Author(s)
f2775e93528da5c439a57c542b520d873c8d3e4e.json,The Intestinal Eukaryotic and Bacterial Biome of Spotted Hyenas: The Impact of Social Status and Age on Diversity and Composition
3e7042ac51bcdbd64db05d998292e8ed45ebfc07.json,Structure of the host cell recognition and penetration machinery of a Staphylococcus aureus bacteriophage
76774987e549a1e89a4b73189cc630193ed25e72.json,Application of mass spectrometry to molecular diagnostics of viral infections
8ae137c8da1607b3a8e4c946c07ca8bda67f88ac.json,Discovering human history from stomach bacteria
9d9347a3f4d7fe21a8d2bdc9aa593830a6856630.json,A barnavirus sequence mined from a transcriptome of the Antarctic pearlwort Colobanthus quitensis
6b18741fd5c6ab895acb11a559286c68b43eb9d4.json,Perspective Bioinformatics in China: A Personal Perspective
bd8bee485194f10f696c48bbe1b9193a006292f4.json,Bahri)
786e2292469a024a05dda14af4e9c6ffaa223d75.json,viruses Overview of Trends in the Application of Metagenomic Techniques in the Analysis of Human Enteric Viral Diversity in Africa's Environmental Regimes
f87d2665175ce7e1c6ffd14e0da7bfc21b784e2e.json,ViralORFeome: an integrated database to generate a versatile collection of viral ORFs
f64a7539cff0d59ff66885154be0f6d105e4a3ad.json,VirHostNet: a knowledge base for the management and the analysis of proteome-wide virus-host interaction networks
68e4d8ce02ce0fbbf81ef369620ef3b220be6f51.json,Language model-based automatic prefix abbreviation expansion method for biomedical big data analysis
64b327001f8fa95b83dc23259a2ad617be12498c.json,HIV-1 Protease Evolvability is Affected by Synonymous Nucleotide Recoding 1 2
dc906285d06f6d7596e1793da1dadfe9242a09a5.json,Origin of the Human Ll Elements: Proposed Progenitor Genes Deduced from a Consensus DNA Sequence
b1e02833bf7b2d8db0c1c82d9f5186392f14ae24.json,Mutation patterns in human α-galactosidase A
0757f72f342223d672e7ce68264126709bec610b.json,Contrasted patterns of variation and evolutionary convergence at the antiviral OAS1 gene in old world primates
0b627ea5840e5e48709565840313984dc900af8d.json,Macroevolutionary immunology: a role for immunity in the diversification of animal life
67ad221f50d67a02b89b0ea67da2a74d6d463d16.json,Directional and reoccurring sequence change in zoonotic RNA virus genomes visualized by time- series word count OPEN
a841a20b663330228ca243c8c25753fff73cfa4e.json,Supplementary Material RAN TRANSLATION AND FRAMESHIFTING AS TRANSLATIONAL CHALLENGES AT SIMPLE REPEATS OF HUMAN NEURODEGENERATIVE DISORDERS
5b25c21a882848393a88f2036871db32f76c7a80.json,Construction and next-generation sequencing analysis of a large phage-displayed V NAR single-domain antibody library from six naïve nurse sharks
6737b541bf9d5d5bbb80cc1dd06456f93dbcda72.json,Evolution of the Bovine TLR Gene Family and Member Associations with Mycobacterium avium Subspecies Infection
9f87d0f127411cb1dc51dbd3041aaecc008d7b8d.json,MERS-CoV recombination: implications about the reservoir and potential for adaptation
d7528a14c4876dbffb163105631a9dea22f20f83.json,Glycosylator: a Python framework for the rapid modeling of glycans
f808fc130cc1ae282a1905872d2dba803d5ff1de.json,Connecting viral with cellular interactomes This review comes from a themed issue on Host-microbe interactions: viruses Edited by Lucas Pelkmans
92e14fff3e37477102149550fc8f3ff9d5ffc6f6.json,HIV-1 Modulates the tRNA Pool to Improve Translation Efficiency
8d03e1689613cf8af353a27d62adaf44e1b20e67.json,Evolutionary Responses to a Constructed Niche: Ancient Mesoamericans as a Model of Gene-Culture Coevolution
b9b0cad2db02479624a3d087626811e4d2fbcdb9.json,Changes in temperature alter susceptibility to a virus following a Short title: Influence of temperature on virus host shifts 4 5
bb1794023d3989be1de19bcd8c0ee1fd37a1b450.json,Automatically Fixing Errors in Glycoprotein Structures with Rosetta Graphical Abstract Highlights d New method for refinement of carbohydrates with low- resolution electron density d Improved physical geometry of glycans in protein structures d Compatible with cryoEM and X-ray crystallography data Automatically Fixing Errors in Glycoprotein Structures with Rosetta
f8592a7f0e0cb468e816e6ada5c57271f35b4257.json,Characterization of microbial pathogens by DNA microarrays
3d0778430adbbbc96d00837831f9a1ce1d4ff35b.json,Cloning
f595066c0454a407001920c8baf1edb260e9bb9d.json,RPiRLS: Quantitative Predictions of RNA Interacting with Any Protein of Known Sequence
06c4f9daabdf5ee16fb4b581a954e3909d9f17a0.json,Computational Analysis of Cysteine Proteases (Clan CA
197b43b5d9077beba4fb4533aeb896705f5b33c8.json,Asymmetric evolution in viral overlapping genes is a source of selective protein adaptation
2759426af4c8df595f4b5e76b614712fda6da5d3.json,K-Pax2: Bayesian identification of cluster-defining amino acid positions in large sequence datasets
f012e9f73359ad9dbd89f041c7b5380301e1610b.json,How many species of Apodemus and Rattus occur in China? A survey based on mitochondrial cyt b and morphological analyses
bd4759d35b86cbbbe9d91ee5666334d78fb27afb.json,Self-similarity analysis of eubacteria genome based on weighted graph
6b58f76c98afb6435969ef4d9f9a063058265b98.json,Isolation and Characterization of a Novel Gammaherpesvirus from a Microbat Cell Line A new report describes the isolation and characterization of a novel gammaherpesvirus from a microbat cell line crossmark
76d2990a2663635e195b8a9818f9664872b6d3af.json,Metagenomic Assay for Identification of Microbial Pathogens in Tumor Tissues
176274e5fb44083ebc8c91d87e013d624533c7f6.json,Conservation and Variability of Dengue Virus Proteins: Implications for Vaccine Design
fff3678cfe3ce7a9ccae1e7becf17d5d71d1b54a.json,Gaining Insights into the Codon Usage Patterns of TP53 Gene across Eight Mammalian Species
8b428fa1fc5626bb38ba1efdb48d715b545f262c.json,Evolution and Variation of the SARS-CoV Genome
3461d71f6890f7e5ba53bf168be3945cdb16d901.json,MERS-CoV recombination: implications about the reservoir and potential for adaptation
fb5b202baa650dfcaaf4a1c863b67b2c36e0fd0c.json,Analysis of synonymous codon usage and evolution of begomoviruses *
f8243fd9214e2e45a222a43aad977d882f17e1e9.json,Computational analysis and determination of a highly conserved surface exposed segment in H5N1 avian flu and H1N1 swine flu neuraminidase
6c3d20fd2c5c86c813cddcaef028a3c5f6d7cf34.json,molecules iPPBS-Opt: A Sequence-Based Ensemble Classifier for Identifying Protein-Protein Binding Sites by Optimizing Imbalanced Training Datasets
efdf0a3bdc300ce80392b2b52be33728db54a51f.json,A Novel Gene Underlies Bleomycin-Response Variation in Caenorhabditis elegans
7f7c8429d7011635b8f8a3415e6ace00c2bf4df0.json,Parasite and viral species richness of Southeast Asian bats: Fragmentation of area distribution matters
37f723594fc45504f7f8d4fc7ca0190513a639c0.json,Expansion and Functional Divergence of AP2 Group Genes in Spermatophytes Determined by Molecular Evolution and Arabidopsis Mutant Analysis
edd747081d0cb8dabb5b44b3d02e0e709f393102.json,Mass extinctions
5208ab18e0b8b851eabda0c5c83c1d31156da8e0.json,Evolution of the uniquely adaptable lentiviral envelope in a natural reservoir host
4e6b644a4ef4abd5283c18ec18237ca58e0d52e3.json,Human Genomic Loci Important in Common Infectious Diseases: Role of High-Throughput Sequencing and Genome-Wide Association Studies
5d902f20842783b98928a4c7147fb9da89a01825.json,PERSPECTIVE PERSPECTIVE
49d38b24e73f9fc1e483f13ca5b9cbfc298fcd95.json,Cdrom Archive: A Gateway to Study Camel Phenotypes
85f3094090aea658156e8729815be766456bc47d.json,What is the importance of zoonotic trichomonads for human health?
d29c253b473969c4d92ea9911d3badb9a7ee63f2.json,A nematode-specific gene underlies bleomycin-response variation in Caenorhabditis elegans 1 2
86c68d9b158d6b327fd9e6ff748fff6d5e2167bb.json,The population genetics of drug resistance evolution in natural populations of viral
c7f6279f66beae3b044d0817f5fa16ab91ef22f8.json,Evolution of Bcl-2 homology (BH) motifs -homology versus homoplasy Spotting diversity in the Bcl-2 portrait gallery NIH Public Access
91e807f991ce190a25835b2cb4d0ee92ec63545d.json,Reconstructed Ancestral Sequences Improve Pathogen Identification Using Resequencing DNA Microarrays
607aa9711d859da642e241a3b8ea8b5436aa73e7.json,Analysis of synonymous codon usage in Newcastle disease virus hemagglutinin-neuraminidase (HN) gene and fusion protein (F) gene
0bf94abcb4b8888debea24c313ed1a329e7a0bb7.json,Virus Structure and Classification 2.1 COMMON CHARACTERISTICS OF VIRUSES
e53306862eb2cab646ba36a1e685fdb5a392da42.json,A new look at an old virus: patterns of mutation accumulation in the human H1N1 influenza virus since 1918
4fc5ea08bc8213609b854d5e4ffd02bd609298a7.json,Mutualistic viruses and the heteronomy of life
198ed53d956a2707716d175cc6516bb720f52d82.json,Integration of the Gene Ontology into an object-oriented architecture
b582a1fd39191ffdd515a4c909a446bce345165b.json,System analysis of synonymous codon usage biases in archaeal virus genomes
dc16bda747bf057fc2d5f0a433dc709f369e6720.json,FSDB: A frameshift signal database
7ecd9c705ef6139a844ddd89963c07ca62a496d6.json,Microbial Genomics and Infectious Diseases
a2cce99039a3ce14630260424bdca8a3c4bf9258.json,Virion Structure
356b49eeee107ff0397b374e29cdd8f133b2688f.json,Genetic variation in the C-type lectin receptor CLEC4M in type 1 von Willebrand Disease patients
b6d49512ce3a1a6d71dc5e5c45a8bd9e76662b5b.json,Ribosomal RNA depletion or exclusion has negligible effect on the detection of viruses in a pan viral microarray
cd06185d94b38abd3c8209a45897a589da964bf2.json,De novo Sequence Assembly and Characterization of Lycoris aurea Transcriptome Using GS FLX Titanium Platform of 454 Pyrosequencing
c88c8d2c02e3e0673d6e0a42930a2c1ce1f3981c.json,Viral evolution
810e609cbc20ab7c1543f7131f18b7fd0a3e2ca8.json,Dual priming oligonucleotide system for the multiplex detection of respiratory viruses and SNP genotyping of CYP2C19 gene
c2a69ec62b5553d158b04c9a91409e451f91e2ee.json,Demographic and environmental drivers of metagenomic viral diversity in vampire bats
399cef5a5c8ca96a0ac33ee31dec722eac145a7b.json,FLDS: A Comprehensive dsRNA Sequencing Method for Intracellular RNA Virus Surveillance
430e170a0e1d7b50278f2626184d00ed87edd2d4.json,The Palm Subdomain-based Active Site is Internally Permuted in Viral RNA-dependent RNA Polymerases of an Ancient Lineage Present addresses
8c2a8441b90805f7cc16caf843e74f0df495a551.json,Gene Expression Profiling: From Microarrays to Medicine
b281ffd13e1ca8492cc60ae608b6b24a7be46a1f.json,Methods for simultaneously identifying coherent local clusters with smooth global patterns in gene expression profiles
540ccda8bb32d2b9192782b878cc2759da109212.json,Evolution and Structural Organization of the C Proteins of Paramyxovirinae
6c0e812085b545051383ce67d04d55f54ff012d2.json,ORIGINAL ARTICLES RNA Pseudoknots Downstream of the Frameshift Sites of Retroviruses
93a9ce5dc65920bc235049037d9c03b211395c57.json,Quasispecies and the implications for virus persistence and escape
e100d3d45507da10018bc2b410c93072756fef47.json,Genomics and Proteomics of Mycobacteriophage Patience
69d2e69e949dab8909be8c7b764a0d5469546b31.json,Evaluation of reference genes for real-time quantitative PCR studies in Candida glabrata following azole treatment
51d7f503fd0210340c4af70eac1f146c86ef36c1.json,Analysis of synonymous codon usage in SARS Coronavirus and other viruses in the Nidovirales
5ef04a13e99d347f738debb9d8683ff70abe52bb.json,Comparing viral metagenomics methods using a highly multiplexed human viral pathogens reagent NIH Public Access
365b8f727f890a4833a5ab7ca03d443022e7faf2.json,LoFreq: a sequence-quality aware
ed8be13266b1bf10596832ff4101729f8fa05935.json,Genomic organization and adaptive evolution of IGHC genes in marine mammals
e4e5e67fd4f75548dffab7f75484bc14fa15c0c2.json,Existing host range mutations constrain further emergence of RNA viruses
2f9f32fc7d8af64617d6bbd88c7a42dec0e13a90.json,BMC Genomics Evidence of host-virus co-evolution in tetranucleotide usage patterns of bacteriophages and eukaryotic viruses
5a5dde5900813ecf3b68e226c3976cb2226ccf5b.json,Citation:) miPepBase: A Database of Experimentally Verified miPepBase: A Database of Experimentally Verified Peptides Involved in Molecular Mimicry
39e066c95d89964b9cd608c14fc5e2077706e72e.json,deep sequencing in infectious diseases: immune and pathogen repertoires for the improvement of patient outcomes The inaugural workshop Deep Sequencing in Infectious Diseases: Immune and Pathogen Repertoires for the Improvement of Patient Outcomes was held in Singapore
dd286ebc387ae032200bd0b1c1d4f659e278d7b0.json,A novel immunity system for bacterial nucleic acid degrading toxins and its recruitment in various eukaryotic and DNA viral systems
de3e0083918cb84a1b2df214b7cd898afbe12206.json,Characterization of G-Quadruplex Motifs in espB
819902e2222b531ae0a6016763e43618b2988516.json,Database resources of the National Center for Biotechnology Information NCBI Resource Coordinators The National Center for Biotechnology Information (NCBI) provides a large suite of online resources for biological information and data
6cdf77493d44c52ce952630eac65a794ef653ba8.json,Vector-based genetically modified vaccines: Exploiting Jenner's legacy
c6e2851ef1f6e35c2954eeaa913f2da2502842d9.json,Evolution of codon usage in Zika virus genomes is host and vector specific
792956320e7955328ce6f1d6cfacff64d1338c5b.json,Selection of suitable reference genes for normalization of quantitative RT-PCR (RT- qPCR) expression data across twelve tissues of riverine buffaloes (Bubalus bubalis)
49a9a8769ece770dba1c78176dfe4264e51fad4b.json,An uncharacterized FMAG_01619 protein from Fusobacterium mortiferum ATCC 9817 demonstrates that some bacterial macrodomains can also act as poly- ADp-ribosylhydrolases
c58c08a98c55feca9f7301682ed7f710b4507026.json,Conservation Genetics of the Cheetah: Genetic History and Implications for Conservation
8e4a1132b0301964add6af40ca83b222d7f6d9e3.json,Rhodopsin Molecular Evolution in Mammals Inhabiting Low Light Environments
6e2b123ad273e69afefb875594ac0fac7c785c74.json,BMC Veterinary Research Expression stability of commonly used reference genes in canine articular connective tissues
4e70161128a045145f613dfd2029d383e4dde823.json,Emerging Concepts of Data Integration in Pathogen Phylodynamics
2618f1868d3eaf92f7f306467b9c8d91ec7572ba.json,Integrating Transcriptomic and Proteomic Data Using Predictive Regulatory Network Models of Host Response to Pathogens
99d730ff4e80cd42f0304b9d80d7d0df0689888d.json,Advances in Visualization Tools for Phylogenomic and Phylodynamic Studies of Viral Diseases
c87dd649f59e20eb70f183915439806a57a13f7a.json,Origins of peptidases
b9a8782661a61d1562b8d6a2098fd35c76b35349.json,Origin
879387ff0282d3823d01dded6b50b383e1741342.json,Mating strategy is determinant of adenovirus prevalence in European bats
36e602b7081e7bb8a1cfeaa2fb92b0c43abd4fef.json,Direct RNA nanopore sequencing of full-length coronavirus genomes provides novel insights into structural variants and enables modification analysis
435baf47b4f78fc06a8376f451993059407d2972.json,Global Surveillance of Emerging Influenza Virus Genotypes by Mass Spectrometry
b64600216303a5d0ba53a87405af547758a9e90a.json,Specific Plasma Autoantibody Reactivity in Myelodysplastic Syndromes ............................................................................. Supplementary Method Details! 3 ..................................................................................................... ProtoArray Analysis! 3 ......................................................................................... Data and Array Information! 5 .......................................................................................... Supplementary Figures! 6 Supplementary Figure S1. High Priority Proteins Functions and Cellular ........................................................................................................................ Location! 6 .... Supplementary Figure S2. Aggregate Signal Profiles for Two Channel Arrays! 7 Supplementary Method Details
3c51ef8a5ac17b4e6d461b5997f29a8324dd8a02.json,Accurate characterization of the IFITM locus using MiSeq and PacBio sequencing shows genetic variation in Galliformes
ac010b5283a82fc9910f62bc57b387b4d401e71f.json,This is a repository copy of An upstream protein-coding region in enteroviruses modulates virus infection in gut epithelial cells. Supplementary information file An Upstream Protein-Coding Region in Enteroviruses Modulates Virus Infection in Gut Epithelial Cells
c49e3b42331dd3c65340f486f5b6067df16cbbd4.json,Open Access E-Predict: a computational strategy for species identification based on observed DNA microarray hybridization patterns
391670ccb8e5d050b8a294eb04628ba69db2ba7f.json,MULTIPRED2: a computational system for large-scale identification of peptides predicted to bind to HLA supertypes and alleles
ba3471e86d6880f42f1df67c9a381e83216d1b45.json,From sequence to enzyme mechanism using multi-label machine learning
b499a41ad1d85a0e071b59e60065c874e534911d.json,Coronavirus 3CL pro proteinase cleavage sites: Possible relevance to SARS virus pathology
59e38a20d75af722bbd918bcbafadabd67094865.json,Analysis of the mitochondrial genome of cheetahs (Acinonyx jubatus) with neurodegenerative disease
0597fe4660f3e0988c92a685d615b4a38a5527e0.json,Genetic structure of mountain lion (Puma concolor) populations in California
85581e91ad30b4385cbd57496aaaf5f19ff33080.json,Computational Resources in Infectious Disease: Limitations and Challenges
27ee6e389b8f87a3545232db8b8fe385f73e5003.json,vaccines Elucidating the Role of Host Long Non-Coding RNA during Viral Infection: Challenges and Paths Forward
02e34b2fe0968cb8a46313fe767858da7e2691b1.json,Candidates in Astroviruses
9197060a4f302bde85b29584b40a2c75ba28f837.json,Conserved antigenic sites between MERS-CoV and Bat-coronavirus are revealed through sequence analysis
8a2b2c72af5a57c21d912a3f1e543bcd75345883.json,Application of next-generation sequencing technologies in virology
3ee10f61fbf042f0e6c1f90b5e26a1199c13f177.json,Virology Journal Could FIV zoonosis responsible of the breakdown of the pathocenosis which has reduced the European CCR5-Delta32 allele frequencies?
b1577fbdc56e73d9a509bf83ada71cae3c142ee3.json,Study of peptide fingerprints of parasite proteins and drug-DNA interactions with Markov-Mean-Energy invariants of biopolymer molecular-dynamic lattice networks
39bcebdc3bcbd99003d65cff0a1601e56a1fa55e.json,Proteomics and HostePathogen Interactions: A Bright Future? 11
750eb3af6059e879b20beac9fb982f85332dd552.json,Evidence of translation efficiency adaptation of the coding regions of the bacteriophage lambda
d54f3fe4cf51fd80a04696c49d4fdc0455b8fe21.json,Synthetic viruses-Anything new? Synthetic horsepox virus raises concerns
5fa8a1eb8fab8c225ab28402700a6c3aa950f2d6.json,DBatVir: the database of bat-associated viruses
636a2debbb56c9142bbf960d9a200665c556e05a.json,Multiplexed Nucleic Acid Programmable Protein Arrays
398cbb196acb9f8ee91a22edcca3b32c044878b8.json,Evolutionary reversion of live viral vaccines: Can genetic engineering subdue it?
35808155b612d2189d338168dc1cc0e0b7401661.json,Selection of reference genes for qRT-PCR examination of wild populations of Atlantic cod Gadus morhua
ca1f90fcd49058d95c081f507c5496b6b962c982.json,Prediction of Antimicrobial Potential of a Chemically Modified Peptide From Its Tertiary Structure
c46224620e6c2f039588f57d5133dedd75941da5.json,RNA-Seq Based Transcriptional Map of Bovine Respiratory Disease Pathogen ''Histophilus somni 2336
5718bd92934aeeabb9cee6354a5ea32a341f1c76.json,The diversity
85f09ba83bd1cd36deec9b52942cc0e390c3b054.json,Rapid characterization of microorganisms by mass spectrometry -What can be learned and how?
8966ac6675efb0bad372010ed73b82e30c4f1624.json,Efficient and unbiased metagenomic recovery of RNA virus genomes from human plasma samples OPEN
35173a96f21f1e674e63d473864215d025f76d0d.json,Conserved presence of G-quadruplex forming sequences in the Long Terminal Repeat Promoter of Lentiviruses
906b616191eea5e5e724d47546f7d2d9d096ed7a.json,Ensemble Feature Selection and Meta-Analysis of Cancer miRNA Biomarkers
3e5633a9a76a8c03e4ec57e4659872a63f045117.json,Severe acute respiratory syndrome-related coronavirus: The species and its viruses -a statement of the Coronavirus Study Group
b87abcd932d557711e3aa64ce8495b42fc4a13e2.json,Viral fitness: definitions
67595d2304315ae4af47ec96fbd42c55bd6855e2.json,ORMA: a tool for identification of species-specific variations in 16S rRNA gene and oligonucleotides design
d9622ec04bc88f584cd280c9dccd177066960cf0.json,Modeling site-specific amino-acid preferences deepens phylogenetic estimates of viral sequence divergence
ee643b9d23927614658ae98af37058f86745ffc9.json,New method for global alignment of 2 DNA sequences by the tree data structure
9016b018eebc8b664e98f9ff2cd6f05ea1742dc7.json,Bats Are an Untapped System for Understanding Microbiome Evolution in Mammals
f62d64a50f26c6a45fc9f049fcaba788600bedbb.json,Parallel molecular evolution and adaptation in viruses
b571790a3eb2e8e7b5448ff8a972d5b9c7fee259.json,Time scale evolution of avipoxviruses-NC-ND license (http://creativecommons.org/licenses/by-nc-nd/4.0/)
26b43aa70c7a8314456956b5ada051dc6807dc56.json,Optimal design and validation of antiviral siRNA for targeting HIV-1
b44258fb9be12d1ddecb77617f2cf7914313d35c.json,NCBI Viral Genomes Resource
5bc5b2f9dee2ff454efe226384070d467112e25d.json,A 2D graphical representation of the sequences of DNA based on triplets and its application
f287cdbc6b706443ee5c1a1e50050515d8a613c7.json,Detection and characterization of microRNA expression profiling and its target genes in response to canine parvovirus in Crandell Reese Feline Kidney cells
3331e1bb231ae4227e4b6e8e98412b17468747a1.json,Protein co-expression network analysis (ProCoNA)
ad142e62f592ce97eeda012293c8758d8a2c42ab.json,Probabilistic analysis of the frequencies of amino acid pairs within characterized protein sequences
d62432d389bb14a9ec748202e5d7f6dc82da4922.json,Estimating residue evolutionary conservation by introducing von Neumann entropy and a novel gap-treating approach
